,id,name,description,employer.name
0,50584634,Старший специалист контактного центра по работе с просроченной задолженностью (Самара),"<p><strong>Что ты получишь/Что мы предлагаем/Что мы обещаем:</strong></p> <p> </p> <p>- Для сотрудников Сбера минимальное ипотечное кредитование – на 4% ниже рыночной ставки!</p> <p>- Бесплатная подписка СберПрайм+ с выгодными условиями и скидками на продукты компаний-партнеров: Okko, Сбер Маркет, Delivery Club, Самокат, СитиМобил, Сбер ЕАптека и другие;</p> <p>- Удобный График 2/2 (8.00 – 20.00) – свободное время, можно уделить семье и образованию;</p> <p>- Работа в современном офисе (в будущем будет возможна удаленная работа);</p> <p>- Ежемесячная стабильная премия – все зависит от тебя – можешь увеличить свой месячный доход в 1,7 раз за счет премии. Годовая премия от эффективности работы;</p> <p>- Желателен минимальный опыт, более детально – обучат профессионалы;</p> <p>- Возможность менять направление работы внутри подразделения – с более сложными клиентами, с кредитами юридических лиц, или на входящую линию, или на взыскание через чат и почту;</p> <p>- Возможность ежедневного развития через продвинутые технологии анализа речи и модель распознавания эмоций клиентов и сотрудников;</p> <p>- Не стоим на месте, точно будет интересно – постоянно проходят новые проекты и пилоты;</p> <p>- Очень сильный внутренний тренерский состав – марафоны для прокачки навыков, тренинги, вебинары.Виртуальная школа с десятками курсов и современной библиотекой, Корпоративный университет и возможность учиться за счет компании;</p> <p>- Можно получить помощь внутреннего психолога бесплатно, в удобное время, все конфиденциально;</p> <p>- Руководители, которые следуют современным стилям менеджмента, креативные и постоянно развивающиеся;</p> <p>- Любителям спорта - Бесплатный тренажерный зал, зал для кардио- тренировок, хамам с мужским и женским залами. Баскетбольная и волейбольная площадка, Участие в Сбербанкиаде;</p> <p>- Не нужно задумываться, где покушать – есть большая столовая со здоровым питанием буфет, снек-бар, оборудованный кофе-поинт;</p> <p>- Организованы комнаты отдыха. Перерывы распределены таким образом, что каждые 2 часа перерыв;</p> <p>- На территории есть аптека;</p> <p>- Парковка без ограничений;</p> <p>- Корпоративный магазин с продукцией банка;</p> <p>- Цветочный магазин;</p> <p>- Профсоюзная организация;</p> <p>- Возможность участвовать в КВН, активная жизнь в части социальных и экологических проектов (помощь приютам для животных, детям-сиротам, пожилым людям);</p> <p>- ДМС со стоматологией в лучших клиниках города. А также страхование от несчастных случаев и тяжелых заболеваний;</p> <p>- <strong>А ещё — мы одни из лучших работодателей страны по версии HH!</strong></p> <p><strong>Ты сможешь прокачать навыки:</strong></p> <p>- Общения с людьми;</p> <p>- Сможешь лучше разбираться в людях (какие типы клиентов бывают и как с ними взаимодействовать);</p> <p>- Управлять чувствами и эмоциями людей;</p> <p>- Продвинутые способы работы с возражениями.</p> <p><strong>Что нужно будет делать:</strong></p> <p>- Общаться по телефону с клиентами Банка по возврату просроченной задолженности;</p> <p>- Предлагать клиентам способы урегулирования задолженности;</p> <p>- Отвечать на вопросы по кредитным продуктам Банка.</p> <p><strong>Ты подходишь нам, если:</strong></p> <p>- Имеешь законченное средне-специальное или высшее образование;</p> <p>- Обладаешь четкой и грамотной речью, умеешь убеждать и разрешать конфликтные ситуации;</p> <p>- Готов весь день работать «на телефоне».</p>",Сбербанк
0,52769325,"Старший менеджер по обслуживанию (Саратовская обл, Петровский район, с.Сосновоборское)","<p>Сбер — лучший работодатель России. У нас более 60 компаний экосистемы и 14 тысяч подразделений по всей стране.</p> <p>Мы ищем старших менеджеров по обслуживанию клиентов Сбера. Это специалисты, которые проводят операции клиентов отделения банка.</p> <p><strong>Эта работа подойдет тебе если ты:</strong></p> <ul> <li>хочешь стать экспертом в банковской сфере</li> <li>доброжелателен и готов помогать клиентам</li> <li>специалист со средним профессиональным, неполным высшим или высшим образованием</li> <li>владеешь программами Microsoft Office, Outlook</li> <li>готов к работе, предполагающей ежедневное проведение однотипных операций.</li> </ul> <p> </p> <p><strong>Тебе предстоит:</strong></p> <ul> <li>осуществлять операции по обслуживанию клиентов</li> <li>проводить кассовые операции: прием, выдача, обмен денег</li> <li>предлагать продукты и сервисы Сбера</li> <li>консультировать клиентов по возникающим вопросам.</li> </ul> <p> </p> <p> </p> <p><strong>Работа в Сбере – это: </strong></p> <ul> <li>стабильный оклад и социальная поддержка сотрудников</li> <li>официальное оформление с первого дня</li> <li>ДМС с первого дня и льготное страхование для близких</li> <li>корпоративное обучение за счет компании</li> <li>бесплатная подписка СберПрайм+, скидки на продукты компаний-партнеров: Okko, Сбер Маркет, Delivery Club, Самокат, Сбер Еаптека и других</li> <li>корпоративная пенсионная программа</li> <li>ипотека выгоднее на 4% для каждого сотрудника.</li> </ul> <p> </p> <p> </p> <p>Присоединяйся к команде старших менеджеров по обслуживанию Сбера!</p> <p> </p>",Сбербанк
0,54971081,Менеджер по работе с ключевыми клиентами малого бизнеса,"<p>Сбер — лучший работодатель России. У нас более 60 компаний экосистемы и 14 тысяч подразделений по всей стране.</p> <p> </p> <p>Присоединяйся к команде малого бизнеса Сбера! На позиции «Менеджера по работе с ключевыми клиентами» ты будешь общаться с предпринимателями и руководителями компаний малого бизнеса и предлагать лучшие решения от Сбера.</p> <p>Эта вакансия для энергичных и общительных людей, готовых вникать в тонкости бизнеса наших клиентов. Мы поможем тебе освоить специальность, сформируем для тебя базу клиентов, предоставим возможности карьерного роста.</p> <p> </p> <p><strong>Тебе предстоит:</strong></p> <ul> <li>развивать бизнес клиентов из закрепленной базы, предлагая продукты и услуги Сбера</li> <li>проводить переговоры с клиентами на территории комапний-партнеров</li> <li>привлекать новых клиентов на обслуживание в Сбер</li> <li>проводить переговоры с предпринимателями и руководителями компаний</li> <li>выстраивать долгосрочное сотрудничество с клиентами.</li> </ul> <p> </p> <p> </p> <p><strong>Мы ждем от тебя:</strong></p> <ul> <li>высшее или неполное высшее образование</li> <li>опыт в сфере продаж корпоративным клиентам</li> <li>понимание основ ведения бизнеса</li> <li>умение выстраивать отношения с людьми</li> <li>готовность к разъездной работе.</li> </ul> <p> </p> <p>Присоединяйся к команде малого бизнеса Сбера!</p> <p> </p> <p><strong>Приглашаем кандидатов с опытом работы на позициях</strong>: менеджер по работе с ключевыми клиентами, менеджер по привлечению корпоративных клиентов, менеджер по кредитованию бизнеса, финансовый менеджер, менеджер по работе с юридическими лицами, клиентский менеджер прямых продаж, кредитование малого и среднего бизнеса, менеджер по обслуживанию юридических лиц, менеджер по привлечению клиентов и партнёров, менеджер по привлечению юридических лиц, менеджер по продажам, менеджер по продаже услуг бизнесу, персональный менеджер, финансовый эксперт, менеджер по лизингу.</p> <p> </p> <p><strong>Опыт работы в компаниях:</strong> ВТБ, Альфа Банк, Тинькофф, Промсвязьбанк, Открытие, Юникредит Банк, Газпромбанк, Россельхозбанк, Райффайзен банк, Ситибанк, Совкомбанк <strong>будет преимуществом.</strong></p>",Сбербанк
0,55901151,Старший менеджер по обслуживанию (с.Большая Липовица),"<p>Сбер — лучший работодатель России. У нас более 60 компаний экосистемы и 14 тысяч подразделений по всей стране.</p> <p>Мы ищем старших менеджеров по обслуживанию клиентов Сбера. Это специалисты, которые проводят операции клиентов отделения банка.</p> <p><strong>Эта работа подойдет тебе если ты:</strong></p> <ul> <li>хочешь стать экспертом в банковской сфере</li> <li>доброжелателен и готов помогать клиентам</li> <li>специалист со средним профессиональным, неполным высшим или высшим образованием</li> <li>владеешь программами Microsoft Office, Outlook</li> <li>готов к работе, предполагающей ежедневное проведение однотипных операций.</li> </ul> <p> </p> <p><strong>Тебе предстоит:</strong></p> <ul> <li>осуществлять операции по обслуживанию клиентов</li> <li>проводить кассовые операции: прием, выдача, обмен денег</li> <li>предлагать продукты и сервисы Сбера</li> <li>консультировать клиентов по возникающим вопросам.</li> </ul> <p> </p> <p> </p> <p><strong>Работа в Сбере – это: </strong></p> <ul> <li>стабильный оклад и социальная поддержка сотрудников</li> <li>официальное оформление с первого дня</li> <li>ДМС с первого дня и льготное страхование для близких</li> <li>корпоративное обучение за счет компании</li> <li>бесплатная подписка СберПрайм+, скидки на продукты компаний-партнеров: Okko, Сбер Маркет, Delivery Club, Самокат, Сбер Еаптека и других</li> <li>корпоративная пенсионная программа</li> <li>ипотека выгоднее на 4% для каждого сотрудника.</li> </ul> <p> </p> <p> </p> <p>Присоединяйся к команде старших менеджеров по обслуживанию Сбера!</p>",Сбербанк
0,55368142,Менеджер по работе с ключевыми клиентами малого бизнеса,"<p><strong>Менеджер по работе с ключевыми клиентами малого бизнеса </strong></p> <p> </p> <p>Сбер — лучший работодатель России. У нас более 60 компаний экосистемы и 14 тысяч подразделений по всей стране.</p> <p>Присоединяйся к команде малого бизнеса Сбера! На позиции «Менеджера по работе с ключевыми клиентами» ты будешь общаться с предпринимателями и руководителями компаний малого бизнеса и предлагать лучшие решения от Сбера.</p> <p>Эта вакансия для энергичных и общительных людей, готовых вникать в тонкости бизнеса наших клиентов. Мы поможем тебе освоить специальность, сформируем для тебя базу клиентов, предоставим возможности карьерного роста.</p> <p><strong>Тебе предстоит:</strong></p> <ul> <li>развивать бизнес клиентов из закрепленной базы, предлагая продукты и услуги Сбера</li> <li>проводить переговоры с клиентами на территории компаний-партнеров</li> <li>привлекать новых клиентов на обслуживание в Сбер</li> <li>проводить переговоры с предпринимателями и руководителями компаний</li> <li>выстраивать долгосрочное сотрудничество с клиентами.</li> </ul> <p><strong>Мы ждем от тебя:</strong></p> <ul> <li>высшее или неполное высшее образование</li> <li>опыт в сфере продаж корпоративным клиентам</li> <li>понимание основ ведения бизнеса</li> <li>умение выстраивать отношения с людьми</li> <li>готовность к разъездной работе.</li> </ul> <p><strong>Приглашаем кандидатов с опытом работы на позициях</strong>: менеджер по работе с ключевыми клиентами, менеджер по привлечению корпоративных клиентов, менеджер по кредитованию бизнеса, финансовый менеджер, менеджер по работе с юридическими лицами, клиентский менеджер прямых продаж, кредитование малого и среднего бизнеса, менеджер по обслуживанию юридических лиц, менеджер по привлечению клиентов и партнёров, менеджер по привлечению юридических лиц, менеджер по продажам, менеджер по продаже услуг бизнесу, персональный менеджер, финансовый эксперт, менеджер по лизингу.</p> <p><strong>Опыт работы в компаниях:</strong> ВТБ, Альфа Банк, Тинькофф, Промсвязьбанк, Открытие, Юникредит Банк, Газпромбанк, Россельхозбанк, Райффайзен банк, Ситибанк, Совкомбанк <strong>будет преимуществом.</strong></p> <p> </p> <p> </p>",Сбербанк
0,55155592,Главный эксперт по кибербезопасности (проведение киберучений),"<p><strong>Обязанности</strong></p> <ul> <li>Проведение киберучений;</li> <li>Тестирование на проникновение / исследование защищенности сложных инфраструктур и продуктов;</li> <li>Участие в развитии процессов отдела и направления RedTeam.</li> </ul> <p><strong>Требования</strong></p> <ul> <li>Понимание принципов проведения киберучений (операций RedTeam) и их отличия от классического исследования защищенности (Pentest);</li> <li>Понимание концепции Cyber KillChain, опыт реализации тактик и техник Mitre Att&amp;ck;</li> <li>Опыт эксплуатации уязвимостей веб-приложений в т.ч. разработанных с использованием современных фреймворков и методов Application Security;</li> <li>Опыт эксплуатации уязвимостей ОС Windows / Linux / \*nix, а также специфичных для них сервисов, как в целях получения удаленного исполнения кода, так и для локального повышения привилегий;</li> <li>Понимание ландшафта угроз для разнообразных инфраструктур (в частности, инфраструктур Active Directory, кластеров СУБД, виртуализированных или контейнеризированных окружений и прочих) и опыт их реализации;</li> <li>Наличие профессиональных сертификатов (Offensive Security, GIAC и прочих), опыт решения задач на HackTheBox будет большим плюсом;</li> <li>Знание английского языка на уровне не ниже B1 Intermediate.</li> </ul> <p><strong>Условия</strong></p> <ul> <li>Возможность строить успешную карьеру в самой крупной команде информационной безопасности в стране;</li> <li>Профессиональное обучение;</li> <li>Льготная ипотека для сотрудников;</li> <li>ДМС для сотрудников и льготное медицинское обслуживание для близких;</li> <li>Корпоративный фитнес-зал;</li> <li>Скидки на продукты экосистемы Сбера.</li> </ul>",Сбербанк
