,id,name,description,employer.name
0,55897691,Бизнес/системный-аналитик (SberData),"<p><strong>SberData</strong> – департамент по управлению данными всего Сбера. SberData строит централизованное хранилище данных, объем которого уже превышает 10 ПБ. Это продуктово-ориентированная инженерная команда, разрабатывающая технологические решения для использования нового подхода Сбера к работе с данными и к применению AI.</p> <p><strong>SberDataExchange</strong> – это платформа для обмена большими данными между участниками Экосистемы Сбер.</p> <p><strong>Преимущества работы в нашей команде:</strong></p> <p>· интересные разнообразные задачи</p> <p>· можно расширять экспертизу в смежных областях, подключаться к процессу исследований, непосредственно участвовать в формировании бэклога</p> <p>· работа в Agile, быстрая и живая коммуникация с командой</p> <p>· профессиональная команда разработки</p> <p>· микросервисная архитектура приложения, техническая реализация с использованием современных технологий</p> <p><strong>Обязанности</strong></p> <p>· Подготовка функциональных спецификаций, требований на доработку</p> <p>· Оперативное консультирование команды разработки</p> <p>· Плотное взаимодействие с дизайнером, архитектором, PO: совместная работа в процессе подготовки требований к новой функциональности</p> <p>· Взаимодействие со смежными командами при разработке интеграционных задач</p> <p>· Участие в сессиях дизайн-мышления при проектировании новых функций системы, модернизации текущих процессов</p> <p>· Участие в планировании спринта. Декомпозиция задач для разработки</p> <p>· Проведение митапов для пользователей, подготовка обучающих материалов</p> <p>· Синхронизация знаний в команде SDE, обмен опытом</p> <p><strong>Требования</strong></p> <p>· Опыт работы бизнес/системным аналитиком от 3-х лет</p> <p>· Навык подготовки спецификаций, кратких и максимально понятных команде разработки («без воды»)</p> <p>· Понимание способов интеграции систем, реальный опыт проработки требований к интеграционным взаимодействиям</p> <p>· Работа на проектах разработки ПО с акцентом на пользовательские интерфейсы, подготовка прототипов экранных форм</p> <p>· Опыт описания процессов в виде схем, с использованием нотаций моделирования процессов</p> <p>· Наличие опыта работы в Agile-команде</p> <p><strong>Будет плюсом:</strong></p> <p>· Умение читать программный код</p> <p>· Работа с Figma</p> <p>· Навык подготовки презентаций, проведения обучающих встреч</p> <p>· Опыт ввода в проект новых сотрудников, менторство</p> <p>· Опыт работы с Jira, Confluence</p> <p><strong>Условия</strong></p> <p>· Гибкий график для оптимального баланса работы и личной жизни</p> <p>· Профессиональное обучение, семинары, тренинги, конференции, корпоративная библиотека</p> <p>· ДМС, страхование жизни</p> <p>· Самые инновационные, амбициозные проекты и задачи</p> <p>· Свободный дресс-код</p> <p>· Льготные кредиты и корпоративные скидки</p> <p>· Конкурентная компенсация (премии по результатам деятельности)</p>",Сбербанк
0,54484384,Старший менеджер по обслуживанию (с. Верхопенье),"<p>Сбер — лучший работодатель России. У нас более 60 компаний экосистемы и 14 тысяч подразделений по всей стране.</p> <p>Мы ищем старших менеджеров по обслуживанию клиентов Сбера. Это специалисты, которые проводят операции клиентов отделения банка.</p> <p><strong>Эта работа подойдет тебе если ты:</strong></p> <ul> <li>хочешь стать экспертом в банковской сфере</li> <li>доброжелателен и готов помогать клиентам</li> <li>специалист со средним профессиональным, неполным высшим или высшим образованием</li> <li>владеешь программами Microsoft Office, Outlook</li> <li>готов к работе, предполагающей ежедневное проведение однотипных операций.</li> </ul> <p><strong>Тебе предстоит:</strong></p> <ul> <li>осуществлять операции по обслуживанию клиентов</li> <li>проводить кассовые операции: прием, выдача, обмен денег</li> <li>предлагать продукты и сервисы Сбера</li> <li>консультировать клиентов по возникающим вопросам.</li> </ul> <p><strong>Работа в Сбере – это: </strong></p> <ul> <li>стабильный оклад и социальная поддержка сотрудников</li> <li>официальное оформление с первого дня</li> <li>ДМС с первого дня и льготное страхование для близких</li> <li>корпоративное обучение за счет компании</li> <li>бесплатная подписка СберПрайм+, скидки на продукты компаний-партнеров: Okko, Сбер Маркет, Delivery Club, Самокат, Сбер Еаптека и других</li> <li>корпоративная пенсионная программа</li> <li>ипотека выгоднее на 4% для каждого сотрудника.</li> </ul> <p>Присоединяйся к команде старших менеджеров по обслуживанию Сбера!</p>",Сбербанк
0,55369162,Middle Java разработчик (Sber Business Campaign),"<p>В команду Sber Business Campaign корпоративно-инвестиционного блока Сбербанка ищем Middle Java разработчика.</p> <p><strong>Обязанности:</strong></p> <ul> <li>реализация платформы «Кампаний продаж» - многофункциональное self-service решение для корпоративных клиентов по автоматизации процессов планирования, выполнения, моделирования, контроля и оценки таргетированных кампаний (продажи и сервис) с целью повышения их эффективности и результативности;</li> <li>разработка нового функционала, оптимизация реализованного;</li> <li>участие в код-ревью;</li> <li>взаимодействие с каждой стороной разработки (бэк/аналитика/дизайн/тестирование).</li> </ul> <strong>Требования:</strong> <ul> <li> <p>опыт разработки на Java 8+ в коммерческих проектах <strong>от</strong> 3 лет;</p> </li> <li> <p>глубокое знание Spring Framework, Hibernate, JDBC;</p> </li> <li> <p>знание и опыт применения на практике паттернов проектирования;</p> </li> <li> <p>знание HTTP, REST, gRPC, JSON;</p> </li> <li> <p>опыт разработки приложений на микросервисной архитектуре;</p> </li> <li> <p>понимание организации кэшей, в том числе распределенных;</p> </li> <li> <p>опыт разработки отказоустойчивых систем;</p> </li> <li> <p>опыт работы с реляционными БД (PostgreSQL/OracleDB), навык написания и оптимизации запросов SQL;</p> </li> <li> <p>понимание и опыт работы в команде по agile;</p> </li> <li> <p>навыки работы с Jira и Confluence;</p> </li> <li> <p>высшее техническое образование.</p> <p><strong>Очень серьезным плюсом будет опыт разработки на Python3;</strong><br />Просто плюсом будут:</p> </li> <li> <p>работы с Kubernetes, Docker, Jenkins;</p> </li> <li> <p>опыт работы с OpenShift и Istio.</p> </li> </ul> <strong>Условия:</strong> <ul> <li>Конкурентные условия труда (белая заработная плата, оклад, премии)</li> <li>График работы - стандартный, но с гибким подходом к личным обстоятельствам</li> <li>Большой и комфортный офис с бесплатным спортзалом</li> <li>Программу по поддержанию и улучшению состояния здоровья - ДМС (включая стоматологию), страхование</li> <li>Льготное кредитование в Сбербанке - возможность пользоваться премиальными продуктами Банка на очень специальных условиях</li> <li>Материальная помощь - в радостных и не очень случаях</li> <li>Широкий спектр скидок и привилегий от компаний-партнеров</li> </ul>",Сбербанк
0,55375803,Data-инженер,"<p>Оперативное обеспечение Data Science специалистов блока Риски качественными выборками из различных информационных систем Банка, необходимыми для построения новых моделей, а также для оценки качества и корректировки существующих моделей.</p> <p>Результатом работы дата-инженера и дата-сайнтиста становится прототип математической модели исследуемого бизнес-процесса,который становится основой для внедрения модели в промышленные системы.</p> <p>Для успешного внедрения прототип должен быть подробно задокументирован,как с точки зрения алгоритма получения выборки (зона ответственности дата-инженера),так и с точки зрения заложенной в модель математики (зона ответственности дата-сайнтиста).</p> <p>Технологический стек:</p> <p>· Bigdata: Hadoop, Hive, Impala, Spark, Scala, Python</p> <p>· СУБД: Oracle, Teradata, Greenplum</p> <p>· ETL: Informatica, SAS Enterprise Guide</p> <p>· управление требованиями: Jira, Confluence, BitBucket</p> <p><strong>Обязанности</strong></p> <p>участие в проектировании и разработки витрин и хранилищ данных</p> <p>участие в проектировании и реализации инструментов автоматизации разработки</p> <p><strong>Требования</strong></p> <p>· высшее, техническое либо финансовое образование</p> <p>· опыт работы от 3х лет с одной или несколькими СУБД: Oracle, MS SQL, Teradata либо СУБД стэка Bigdata</p> <p>· опыт работы с хранилищами данных от 1го года</p> <p>· опыт работы в роли аналитика с функцией подготовки выгрузки данных для заказчика</p> <p>· сильные компетенции в области реляционных СУБД и хранилищ данных:</p> <p>· уверенное знание SQL: сложные запросы, аналитически функции, понимание физической реализации join’ов, оптимизация производительности запросов</p> <p>· знание одного или нескольких языков программирования: PL/SQL, T-SQL, Java, Python, Scala на уровне переменных, процедур, функций, циклов, условных операторов</p> <p>· знание одного или нескольких ETL-инструментов: Informatica, MS SSIS, SAS, ODI</p> <p>· понимание принципов организации хранилищ данных, подходов к проектированию логической и физической моделей, понимание основной проблематики хранилищ и подходов к решению</p> <p>· аналитический склад мышления, умение быстро погружаться в новые предметные области</p> <p>· самообучаемость, готовность осваивать новые инструменты разработки и языки программирования</p> <p>· ориентация на результат, проактивный подход к работе, умение довести задачу до логического завершения</p> <p>· развитые коммуникационные и аналитические навыки:</p> <p>· умение структурировать и формализовывать нечеткие требования заказчика</p> <p>· умение декомпозировать работы и оценить их трудоемкость</p> <p>· навыки корректных горизонтальных коммуникаций с соседними подразделениями для получения консультаций</p> <p><strong>Условия</strong></p> <p>• Конкурентные условия труда (белая заработная плата, оклад, премии).</p> <p>• Работа с персональными данными. Необходимо присутствие в офисе.</p> <p>• ДМС.</p> <p>• отличная программа софинансирования пенсионных накоплений</p> <p>• Широкий спектр дисконт-программ, скидок и привилегий от компаний-партнеров.</p> <p>• Льготное кредитование в Сбербанке - возможность пользоваться премиальными продуктами Банка на специальных условиях.</p> <p>• Возможность проходить обучение в лучшем Корпоративном Университете (Европы).</p> <p>• Материальная помощь - в радостных и не очень случаях.</p>",Сбербанк
0,66146454,Program manager,"<p>Мы ищем</p> <p>Управляющих программами и проектами, кто готов поддерживать развитие проектов в области работы с большими данными и высоконагруженными системами.</p> <p><strong>Обязанности</strong></p> <p>У тебя будет возможность выстраивать эффективные процессы для достижения бизнес целей и целей разработки, выпускать высоко востребованный продукт, участвовать в конференциях и применять полученные знания на практике.</p> <p><strong>Требования</strong></p> <p>Что для нас важно:</p> <ul> <li>Практический опыт работы по выпуску программных продуктов.</li> </ul> <p>Будет плюсом:</p> <ul> <li>Знание методик разработки программных продуктов (Waterfall, Agile, Scrum, etc.);</li> <li>Знание PMP стандарта;</li> <li>Опыт реализации требований к безопасности кода и соответствия программного продукта юридическим критериям.</li> </ul> <p><strong>Условия</strong></p> <p>Мы предлагаем:</p> <ul> <li>Официальное трудоустройство согласно ТК РФ;</li> <li>Белая заработная плата (оклад + годовая премия);</li> <li>Страхование (от несчастных случаев, ДМС);</li> <li>Оздоровительные программы для детей сотрудников;</li> <li>Возможность обучения за счет компании;</li> <li>Выплаты материальной помощи в особых/чрезвычайных случаях;</li> <li>Дисконт-программы от компаний партнеров (фитнес, страхование, туризм);</li> <li>Льготное кредитование;</li> <li>Офис: Нижний Новгород, Бекетова 13В</li> </ul>",Сбербанк
0,55128030,Ведущий специалист по взысканию,"<p>Специалист по взысканию помогает клиентам, попавшим в сложную финансовую ситуацию. Эта работа для тех, кто ценит стабильность, хочет работать по четким правилам и стандартам и иметь достойный заработок.</p> <p><strong>Задачи:</strong></p> <p>- Ездить к клиентам по месту жительства или работы.</p> <p>- Вести переговоры с клиентами банка с целью возврата просроченной задолженности (лично и по телефону).</p> <p>- Собирать информацию о клиентах и участниках кредитной сделки: адреса, которые нужно посетить, контактные телефоны.</p> <p>- Консультировать и собирать документы для сделок урегулирования проблемной задолженности, проверять состояние предмета залога.</p> <p>- Помогать клиентам, попавшим в тяжелую жизненную ситуацию.</p> <p><strong>Мы ждем, что ты:</strong></p> <p>- Специалист со средним специальным, неоконченным высшим или высшим образованием.</p> <p>- Готов к разъездной работе.</p> <p>- Умеешь справляться со стрессом и ориентирован на результат.</p> <p>- Готов работать в условиях ежемесячных финансовых целей.</p> <p>- Легко находишь общий язык с людьми разного возраста, пола и социального статуса.</p> <p>- Настойчив в преодолении препятствий и мотивирован на решение амбициозных задач.</p> <p>- Опыт эффективного взыскания проблемной задолженности будет преимуществом.</p> <p><strong>Мы предлагаем:</strong></p> <p>- Оформление согласно Трудовому кодексу.</p> <p>- Зарплата плюс премии по итогам работы.</p> <p>- Гибкий график: с 12 до 21 часов либо с 13 до 22 часов (по выбору сотрудника), 2 рабочие субботы в месяц с выходными воскресенье-понедельник.</p> <p>- ДМС для сотрудников и льготная медицинская страховка для близких.</p> <p>- Регулярное корпоративное обучение.</p> <p>- Скидки на продукты банка и экосистемы.</p>",Сбербанк
