,id,name,description,employer.name
0,66099839,Java-разработчик,"<p><strong>О нас: </strong></p> <p>В SberTech активно развивается проект по улучшению и сопровождению автоматизированных систем и внедрению стороннего ПО. У Вас будет возможность создавать и развивать автоматизацию внутренних процессов SberTech, а также работать в общей экосистеме Сбербанка. Наша компания ориентирована как на внутренних потребителей, так и на продвижение наших продуктов во внешний рынок, поэтому у Вас всегда будут интересные задачи и опыт взаимодействия.</p> <p> </p> <p><strong>Задачи:</strong></p> <ul> <li>Разработка модулей и компонентов информационной системы;</li> <li>Проектирование архитектуры и реализация компонент и интерфейсов, проектирование реализации;</li> <li>Выбор библиотек/фреймворков, компонент технологического стека;</li> <li>Проектирование и разработка спецификаций;</li> <li>Постановка и декомпозиция задач на разработку;</li> <li>Разработка программных интерфейсов по спецификациям и их реализация;</li> <li>Внесение изменений в имеющийся код, рефакторинг кода;</li> <li>Отладка, диагностика причин и устранение дефектов в имеющемся коде;</li> <li>Разработка unit-тестов, автоматических скриптов и тестов развертывания;</li> <li>Выполнение code review;</li> <li>Сборка и развертывание разработанного решения на стенды разработки;</li> <li>Написание технической документации к разрабатываемым компонентам ПО;</li> <li>Постановка задач, управление и контроль работы в рабочей группе (2-3 человека);</li> <li>Обучение и наставничество для менее опытных участников рабочей группы и команды.</li> </ul> <p> </p> <p><strong>Что мы ожидаем:</strong></p> <ul> <li>Отличное знание Java (1.8 и выше);</li> <li>Владение SPRING / SPRING BOOT, (IoC, JPA, MVC, Scheduling),;</li> <li>Брокер сообщений (Kafka);</li> <li>Знание JPA (Hibernate);</li> <li>Maven / Gradle;</li> <li>SQL / JDBC / Транзакционность – обязательны твердое понимание, практические навыки;</li> <li>Опыт работы с базами данных PostgreSQL / Oracle;</li> <li>Понимание контейнеризации (Docker, Kubernetes, OpenShift)</li> <li>Фреймворки тестирования JUnit, TestNG, Mockito</li> <li>Владение системами контроля версий (git);</li> <li>Знание на уровне написания простейших скриптов Linux, bash;</li> <li>Понимание процессов CI/CD, опыт работы с системами обеспечения процесса непрерывной интеграции.</li> </ul> <p> </p> <p><strong>Что мы готовы предложить:</strong></p> <ul> <li>Сложные и интересные задачи: высоконагруженные сервисы, которые задают уровень для конкурентов качеством и технологиями; быстрый рост в трендовых направлениях; амбициозные цели перед каждым проектом;</li> <li>Оборудование: мощное железо, дополнительные мониторы ― все для решения масштабных задач и экспериментов;</li> <li>Команда: работа бок о бок со лучшими из IT-индустрии, каждый из которых может поделиться своей экспертизой;</li> <li>Профессиональное развитие: развиваем культуру профсообществ и внутри компании мы организуем meetup, встречи разработчиков и тестировщиков, семинары и тренинги, куда открыт доступ каждому сотруднику;</li> <li>Новый опыт: лучшие сотрудники выступают на ИТ-конференциях;</li> <li>Офис Даниловский Форт - 10-15 минут от метро Тульская и МЦК Верхние Котлы, крытый паркинг для всех сотрудников, велопарковка;</li> <li>Здоровье и спорт: программа ДМС для сотрудников и их родственников, собственный тренажерный зал в офисе.</li> </ul>",Сбербанк
0,55211610,Frontend-разработчик,"<p>Мы - это продуктовая IT компания по созданию highload проектов в сфере недвижимости.<br />Наш основной проект - ДомКлик - платформа для проведения сделок по недвижимости, доступная на всех популярных платформах (Web, iOS, Android).</p> <p>Сейчас мы в поиске frontend-разработчика в команду Ипотека/СБОЛ. Команда ориентирована на разработку функционала подачи заявки на ипотеку в мобильной и web версии приложения Сбербанк Онлайн.</p> <p><strong>Обязанности</strong></p> <ul> <li>Проектирование и разработка SPA приложений на базе платформы ЕФС;</li> <li>Разработка и поддержка внутренних библиотек;</li> <li>Разработка компонентов React;</li> <li>Контроль качества кода (Code Review);</li> <li>Интеграция с Backend частью приложений;</li> <li>Разработка пользовательских интерфейсов;</li> <li>Оценка задач и участие в планировании работ;</li> <li>Участие в разработке архитектуры приложен.</li> </ul> <p><strong>Требования</strong></p> <ul> <li>Уверенные знания CSS3(SASS/LESS/PostCSS), HTML5. Мы уделяем большое значение доступности;</li> <li>Понимание принципов работы браузеров и веб-серверов;</li> <li>Отличные знания и понимание как работает JS в браузере и не только. Понимание особенностей языка;</li> <li>знание современных методологий разработки frontend-приложений;</li> <li>уверенные знания в ES6 и последней спецификации языка;</li> <li>практический опыт проектирования и разработки на React+Redux;</li> <li>опыт работы с сборщиками проектов (Webpack, Gulp и тп);</li> <li>Unit тесты.</li> </ul> <p><strong>Будет плюсом</strong></p> <ul> <li>Работа с Node.JS;</li> <li>Опыт разработки на базе платформы ЕФС.</li> </ul> <p><strong>Условия</strong></p> <ul> <li>Команда профессионалов, готовых поддержать ваши инициативы;</li> <li>Мощное железо, дополнительные мониторы и всё, что нужно для продуктивной работы;</li> <li>Возможность работы с новыми технологиями;</li> <li>ДМС, страхование от несчастных случаев и тяжелых заболеваний;</li> <li>Материальная помощь и социальная поддержка, корпоративная пенсионная программа;</li> <li>Прозрачная система бонусов и премий, достойная зарплата — размер обсудим на собеседовании;</li> <li>Льготные условия кредитования;</li> <li>доступ к различным курсам обучения по развитию как hard, так и soft skill&#39;ов;</li> <li>Бесплатный спортзал;</li> <li>Красивый и комфортный офис.</li> </ul>",Сбербанк
0,55338171,Инженер поддержки автоматизированных систем,"<p>Мы внедряем и сопровождаем современные сложные технические решения и комплексные автоматизированные системы (АС) внутренней разработки:</p> <p>- по регистрации и отслеживанию заявок пользователей (сотрудников банка и экосистемы группы Сбер) и разным направлениям их работы;</p> <p>- по внутренним коммуникациям сотрудников и наших партнеров: чаты, группы, сообщества, новостные ленты.</p> <p><strong>Обязанности</strong>:</p> <ul> <li>администрировать, внедрять и сопровождать АС - в масштабах банка и с утвержденным уровнем качества.</li> <li>поддерживать доступность АС непрерывность их работы.</li> <li>решать инциденты в наших системах и устранять причины их возникновения.</li> <li>регистрировать проблемы - причины инцидентов, находить решения по проблемам.</li> <li>анализировать данные мониторинга АС, готовить и внедрять предложения по улучшению производительности и надежности систем.</li> <li>участвовать в проектах по развитию АС, в приемо-сдаточных испытаниях новых версий.</li> </ul> <p><strong>Требования</strong>:</p> <ul> <li>высшее техническое образование, предпочтительно в сфере ИТ.</li> <li>знание стандарта ISO20000 и/или ITIL, принципов организации сопровождения АС.</li> <li>понимание архитектуры современных автоматизированных систем / приложений, способов интеграции систем.</li> <li>опыт администрирования /сопровождения сложных прикладных автоматизированных систем.</li> <li>опыт работы с реляционными БД, знание языка запросов SQL</li> <li>опыт работы с системами мониторинга (например, Zabbix).</li> <li>знание английского языка на уровне чтения технической документации.</li> </ul> <p><strong>Технологии, с которыми мы работаем:</strong></p> <ul> <li>HP Service Manager как платформа нашей АС.</li> <li>Серверные ОС семейства Windows Server, Unix-like (RedHat Enterprise Linux).</li> <li>Базы данных - Oracle DB, PostgreSQL.</li> <li>DevOps (Jenkins).</li> <li>Системы логирования (Elastic Search).</li> <li>Облачные технологии, в т.ч. виртуализации и построения распределенных приложений (VMWare, Kubernetes, Docker, OpenShift, Tomcat, Nginx).</li> <li>Скриптовые языки (JavaScript, Groovy).</li> </ul> <p><strong>Условия</strong>:</p> <ul> <li>график 08:00 до 17:00, возможно гибкое начало рабочего дня.</li> <li>оформление согласно ТК РФ, социальный пакет: ДМС, спортзал.</li> <li>возможность обучения за счет компании.</li> <li>конкурентная заработная плата и годовая премия по результату работы.</li> <li>постоянное профессиональное развитие.</li> </ul>",Сбербанк
0,55387935,Клиентский менеджер по работе с региональным госсектором,"<p><strong>Вам предстоит:</strong></p> <ul> <li>построение и развитие долгосрочных партнерских отношений с закрепленными Клиентами, основанных на удовлетворении всех потребностей Клиентов в продуктах и услугах Банка</li> <li>обеспечение высокого уровня сервиса для клиентов РГС (регионального госсектора)</li> <li>увеличение объема продаж и расширение спектра предоставляемых Клиентам продуктов и услуг</li> <li>формирование клиентско-продуктовой команды и обеспечение эффективного/конструктивного и результативного взаимодействия в рамках реализации сделок</li> <li>разработка стратегии развития бизнеса с Клиентами</li> <li>инициирование изменений продуктов/услуг Банка для Клиентов регионального госсектора</li> <li>продажи продуктов и услуг банка клиентам сегмента РГС (регионального госсектора)</li> <li>увеличение глубины отношений с клиентами Банка</li> <li>организация командной работы, планирование продаж, организация кросс-продаж, мониторинг и контроль.</li> </ul> <p><strong>Мы ожидаем, что Вы:</strong></p> <ul> <li>получили высшее профильное образование</li> <li>имеете стаж работы в области финансов не менее 2-х лет</li> <li>имеете опыт продаж зарплатных проектов, эквайринга, РКО</li> <li>обладаете успешным опытом выдачи банковских гарантий, заключении кредитных сделок и сделок по лизингу</li> <li>имеете опыт успешных продаж корпоративным клиентам в финансовой сфере не менее 2-х лет</li> <li>знаете основы банковской деятельности</li> <li>знаете основы формирования Федерального и регионального бюджетов в РФ</li> <li>знаете основы законодательства и банковского регулирования</li> <li>владеете навыками ведения переговоров, консультирования и продаж</li> <li>обладаете знаниями/навыками в области организации обслуживания клиентов Регионального госсектора (далее РГС)</li> <li>обладаете знаниями/навыками в области кредитования клиентов РГС.</li> </ul> <p><strong>Мы предлагаем:</strong></p> <ul> <li>ипотека выгоднее на 4% для каждого сотрудника</li> <li>льготные условия кредитования</li> <li>ДМС с первого дня и льготное страхование для близких</li> <li>бесплатная подписка СберПрайм+, скидки на продукты компаний-партнеров: Okko, Сбер Маркет, Delivery Club, Самокат, Сбер Еаптека и другие</li> <li>корпоративная пенсионная программа</li> <li>обучение за счет компании: онлайн курсы в Виртуальной школе Сбера, возможность получить новую квалификацию</li> <li>курсы для будущих родителей, материальная поддержка молодых мам, детский отдых и подарки за счет компании</li> <li>реферальная программа для сотрудников: можно пригласить в команду знакомых профессионалов и получить вознаграждение до 100 тыс. рублей.</li> </ul>",Сбербанк
0,66120789,Старший менеджер по обслуживанию (с. Каменная Балка),"<p><strong>с. Каменная Балка</strong></p> <p><strong>частичная занятость, 0.5 ставки</strong></p> <p>Сбер — лучший работодатель России. У нас более 60 компаний экосистемы и 14 тысяч подразделений по всей стране.</p> <p>Мы ищем старших менеджеров по обслуживанию клиентов Сбера. Это специалисты, которые проводят операции клиентов отделения банка.</p> <p><strong>Эта работа подойдет тебе если ты:</strong></p> <ul> <li>хочешь стать экспертом в банковской сфере</li> <li>доброжелателен и готов помогать клиентам</li> <li>специалист со средним профессиональным, неполным высшим или высшим образованием</li> <li>владеешь программами Microsoft Office, Outlook</li> <li>готов к работе, предполагающей ежедневное проведение однотипных операций.</li> </ul> <p><strong>Тебе предстоит:</strong></p> <ul> <li>осуществлять операции по обслуживанию клиентов</li> <li>проводить кассовые операции: прием, выдача, обмен денег</li> <li>предлагать продукты и сервисы Сбера</li> <li>консультировать клиентов по возникающим вопросам.</li> </ul> <p><strong>Работа в Сбере – это: </strong></p> <ul> <li>стабильный оклад и социальная поддержка сотрудников</li> <li>официальное оформление с первого дня</li> <li>ДМС с первого дня и льготное страхование для близких</li> <li>корпоративное обучение за счет компании</li> <li>бесплатная подписка СберПрайм+, скидки на продукты компаний-партнеров: Okko, Сбер Маркет, Delivery Club, Самокат, Сбер Еаптека и других</li> <li>корпоративная пенсионная программа</li> <li>ипотека выгоднее на 4% для каждого сотрудника.</li> </ul> <p> </p> <p>Присоединяйся к команде старших менеджеров по обслуживанию Сбера!</p>",Сбербанк
0,54053784,Java разработчик,"<p>HR-платформа<strong> </strong>Сбера - собственный продукт компании, который покрывает весь жизненный цикл работы с человеческим капиталом: подбор, обучение, развитие, оценка, результативность, обратная связь и др.</p> <p>Мы используем современные подходы и методологии: microservices, cloud-native, Machine Learning и AI. Параллельно строим свой SaaS для вывода продукта на рынок. Не забываем о cybersecurity и high load. В команде следуем культуре Agile и DevOps.</p> <p>HR-платформа – это пример продукта, который мы используем сами и хотим предложить своим клиентам. У нас уже реализовано очень много крутых фич, но еще больше находятся в бэклоге. Поэтому нам предстоит много интересной и сложной работы, результатами которой будут пользоваться сотни тысяч сотрудников экосистемы СБЕР и большое количества его клиентов.</p> <p><strong>Обязанности:</strong></p> <p>• Управление командой (развитие членов команды, менторство, постановка задач/целей, обратная по сотрудникам);</p> <p>• Проектирование и разработка нового и сопровождение текущего функционала бизнес-сервисов;</p> <p>• Взаимодействие с разработчиками, аналитиками, архитекторами, дизайнерами и другими командами в формате agile;</p> <p>• Декомпозиция и оценка задач, участие в планировании;</p> <p>• Координация и помощь сотрудникам в ходе выполнения задач;</p> <p>• Проведение интервью, адаптация вновь пришедших разработчиков;</p> <p>• Контроль за соблюдением стандартов работы, написания кода (следовать и улучшать), организация и проведение code-review.</p> <p><strong>Требования:</strong></p> <p>• Уверенное знание Java/Kotlin (используем JDK11) и особенностей языка, опыт коммерческой разработки от 5 лет;</p> <p>• Понимание микросервисной архитектуры, опыт коммерческой разработки на Spring/Spring Boot/Spring Cloud;</p> <p>• Опыт работы с брокерами очередей сообщения (RabbitMQ/ IBM MQ/ Kafka/ ActiveMQ и др.);</p> <p>• Опыт работы с библиотеками для тестирования кода;</p> <p>• Знание подходов проектирования архитектуры высоконагруженных backend приложений, понимание узких мест;</p> <p>• Опыт работы с SQL/noSQL базами данных, понимание принципов масштабирования;</p> <p>• Опыт работы с системами контейнеризации (Docker/Kubernetes/OpenShift);</p> <p>• Понимание практик DevOps, опыт использования;</p> <p>• Опыт управления командой разработчиков;</p> <p>• Опыт организации code-review, понимание git flow;</p> <p>• Высшее техническое образование.</p>",Сбербанк
