,id,name,description,employer.name
0,55899504,IOS разработчик,"<p>В Сбербанк Онлайн мы создаем пространство для информирования клиентов о киберугрозах и способах предотвращения мошенничества. Наши главные задачи – дать клиентам гибкие настройки для управления безопасностью банковских продуктов и рассказать как противостоять социальной инженерии, чтобы сохранить свои деньги. Вам предстоит стать частью креативной команды борцов за кибербезопасность клиентов Сбербанка и заниматься разработкой решений Сбербанк Онлайн и экосистемы Сбер.</p> <p><strong>Обязанности</strong></p> <ul> <li>Выявлять и исправлять ошибки в работе текущего приложения;</li> <li>Реализовывать новые фичи и предлагать свои, участвовать в проработке API;</li> <li>Участвовать в процессе рефакторинга кода;</li> <li>Участвовать в ревью кода;</li> <li>Участвовать в активностях iOS community по улучшению текущих систем в рамках техдолга, и в активностях по проектированию и развитию систем на будущее.</li> </ul> <p><strong>Требования</strong></p> <ul> <li>Знание языка программирования Swift;</li> <li>Работа с фреймворками UIKit, Foundation, CoreData, CoreAnimation;</li> <li>Работа с многопоточностью: GCD, OperationQueue;</li> <li>Понимание архитектур приложений (MVC, MVP, MVVM);</li> <li>Опыт в написании Unit и UI тестов;</li> <li>Сетевые протоколы HTTP/HTTPS. Реализация клиент-серверных приложений, опыт использования URLSession;</li> <li>Опыт использования GIT и GitFlow.</li> </ul> <p><strong>Условия</strong></p> <ul> <li>Уникальная возможность поработать над интересным, крупным проектом;</li> <li>Профессиональный рост в дружной команде профессионалов;</li> <li>Официальное оформление по ТК РФ;</li> <li>Белая заработная плата (оклад + премии);</li> <li>ДМС, страхование от несчастных случаев, корпоративные мероприятия;</li> <li>Программа льготного кредитования в Сбербанке;</li> <li>Дисконт-программы от компаний партнеров.</li> </ul>",Сбербанк
0,53864843,Старший менеджер по обслуживанию (с. Каменная Балка),"<p>с. Каменная Балка</p> <p> </p> <p><strong>Если ты:</strong></p> <ul> <li>хочешь работать в дружном коллективе;</li> <li>стремишься к достижению лучших результатов для клиентов.</li> </ul> <p><strong>Начни работу в крупнейшем банке России и СНГ!</strong></p> <p><strong>Как менеджер по обслуживанию, ты будешь: </strong></p> <ul> <li>осуществлять операции по обслуживанию физических лиц;</li> <li>проводить кассовые операции (прием/выдача/обмен денег).</li> </ul> <p><strong>Ты подходишь нам, если ты:</strong></p> <ul> <li>специалист со средним профессиональным/неполным высшим/высшим образованием;</li> <li>владеешь программами Microsoft Office, Internet Explorer, Outlook;</li> <li>внимателен к деталям;</li> <li>готов к работе, предполагающей ежедневное проведение однотипных операций;</li> <li>проявляешь доброжелательность, готовность оказывать помощь окружающим;</li> <li>выдерживаешь высокий темп работы.</li> </ul> <p><strong>Мы предлагаем:</strong></p> <ul> <li>трудоустройство согласно ТК РФ;</li> <li>гарантированный доход плюс премиальное вознаграждение;</li> <li>возможность работать рядом с домом/местом учебы;</li> <li>регулярное корпоративное обучение;</li> <li>ДМС, страхование от несчастных случаев и тяжелых заболеваний;</li> <li>материальную помощь и социальную поддержку, корпоративную пенсионную программу;</li> <li>льготные условия кредитования;</li> <li>яркую и насыщенную корпоративную жизнь.</li> </ul> <p><strong>Мы ждем тебя, чтобы строить счастливое будущее вместе!</strong></p> <p> </p>",Сбербанк
0,54568057,Старший менеджер по обслуживанию (с. Журавка),"<p>Сбер — лучший работодатель России. У нас более 60 компаний экосистемы и 14 тысяч подразделений по всей стране.</p> <p>Мы ищем старших менеджеров по обслуживанию клиентов Сбера. Это специалисты, которые проводят операции клиентов отделения банка.</p> <p><strong>Эта работа подойдет тебе если ты:</strong></p> <ul> <li>хочешь стать экспертом в банковской сфере</li> <li>доброжелателен и готов помогать клиентам</li> <li>специалист со средним профессиональным, неполным высшим или высшим образованием</li> <li>владеешь программами Microsoft Office, Outlook</li> <li>готов к работе, предполагающей ежедневное проведение однотипных операций.</li> </ul> <p> </p> <p><strong>Тебе предстоит:</strong></p> <ul> <li>осуществлять операции по обслуживанию клиентов</li> <li>проводить кассовые операции: прием, выдача, обмен денег</li> <li>предлагать продукты и сервисы Сбера</li> <li>консультировать клиентов по возникающим вопросам.</li> </ul> <p> </p> <p> </p> <p><strong>Работа в Сбере – это: </strong></p> <ul> <li>стабильный оклад и социальная поддержка сотрудников</li> <li>официальное оформление с первого дня</li> <li>ДМС с первого дня и льготное страхование для близких</li> <li>корпоративное обучение за счет компании</li> <li>бесплатная подписка СберПрайм+, скидки на продукты компаний-партнеров: Okko, Сбер Маркет, Delivery Club, Самокат, Сбер Еаптека и других</li> <li>корпоративная пенсионная программа</li> <li>ипотека выгоднее на 4% для каждого сотрудника.</li> </ul> <p> </p> <p> </p> <p>Присоединяйся к команде старших менеджеров по обслуживанию Сбера!</p>",Сбербанк
0,55009525,Клиентский менеджер прямых продаж,"<p>Сбер — лучший работодатель России. У нас более 60 компаний экосистемы и 14 тысяч подразделений по всей стране.</p> <p> </p> <p>У каждого нашего зарплатного клиента – компаний партнеров — есть свой эксперт по финансовым вопросам. Он приезжает в офисы партнеров банка несколько раз в неделю, презентует наши продукты, консультирует сотрудников компании по продуктам и сервисам, а также помогает с их оформлением.<br />Это работа для тех, кому интересны сфера продаж, развитие навыков убеждения, личных переговоров и выступлений. А также привлекает работа вне офиса.</p> <p> </p> <p> </p> <p><strong>Тебе предстоит:</strong></p> <p> </p> <ul> <li>выезжать к клиентам на индивидуальные консультации</li> <li>проводить презентации сервисов Сбера на территории компаний-партнеров</li> <li>предлагать сервисы Сбера и помогать с их оформлением.</li> </ul> <p> </p> <p><strong>Работа в Сбере – это: </strong></p> <ul> <li>стабильный оклад и социальная поддержка сотрудников</li> <li>официальное оформление с первого дня</li> <li>расширенный ДМС с первого дня и льготное страхование для близких</li> <li>мобильная связь, корпоративный ipad</li> <li>оплата транспортных расходов</li> <li>теплая база клиентов</li> <li>корпоративное обучение за счет компании</li> <li>бесплатная подписка СберПрайм+, скидки на продукты компаний-партнеров: Okko, Сбер Маркет, Delivery Club, Самокат, Сбер Еаптека и других</li> <li>корпоративная пенсионная программа</li> <li>ипотека выгоднее на 4% для каждого сотрудника.</li> </ul> <p> </p> <p> </p> <p>Присоединяйся к команде клиентских менеджеров Сбера!</p>",Сбербанк
0,55223000,Старший менеджер по обслуживанию (п. Серебрянка),"<p>Сбер — лучший работодатель России. У нас более 60 компаний экосистемы и 14 тысяч подразделений по всей стране.</p> <p>Мы ищем старших менеджеров по обслуживанию клиентов Сбера. Это специалисты, которые проводят операции клиентов отделения банка.</p> <p><strong>Эта работа подойдет тебе если ты:</strong></p> <ul> <li>хочешь стать экспертом в банковской сфере</li> <li>доброжелателен и готов помогать клиентам</li> <li>специалист со средним профессиональным, неполным высшим или высшим образованием</li> <li>владеешь программами Microsoft Office, Outlook</li> <li>готов к работе, предполагающей ежедневное проведение однотипных операций.</li> </ul> <p> </p> <p><strong>Тебе предстоит:</strong></p> <ul> <li>осуществлять операции по обслуживанию клиентов</li> <li>проводить кассовые операции: прием, выдача, обмен денег</li> <li>предлагать продукты и сервисы Сбера</li> <li>консультировать клиентов по возникающим вопросам.</li> </ul> <p> </p> <p> </p> <p><strong>Работа в Сбере – это: </strong></p> <ul> <li>стабильный оклад и социальная поддержка сотрудников</li> <li>официальное оформление с первого дня</li> <li>ДМС с первого дня и льготное страхование для близких</li> <li>корпоративное обучение за счет компании</li> <li>бесплатная подписка СберПрайм+, скидки на продукты компаний-партнеров: Okko, Сбер Маркет, Delivery Club, Самокат, Сбер Еаптека и других</li> <li>корпоративная пенсионная программа</li> <li>ипотека выгоднее на 4% для каждого сотрудника.</li> </ul> <p> </p> <p> </p> <p>Присоединяйся к команде старших менеджеров по обслуживанию Сбера!</p> <p> </p>",Сбербанк
0,55555940,Клиентский менеджер прямых продаж,"<p>Сбер — лучший работодатель России. У нас более 60 компаний экосистемы и 14 тысяч подразделений по всей стране.</p> <p> </p> <p>У каждого нашего зарплатного клиента – компаний партнеров — есть свой эксперт по финансовым вопросам. Он приезжает в офисы партнеров банка несколько раз в неделю, презентует наши продукты, консультирует сотрудников компании по продуктам и сервисам, а также помогает с их оформлением.</p> <p>Это работа для тех, кому интересны сфера продаж, развитие навыков убеждения, личных переговоров и выступлений. А также привлекает работа вне офиса.</p> <p> </p> <p> </p> <p><strong>Тебе предстоит:</strong></p> <p> </p> <p>· выезжать к клиентам на индивидуальные консультации</p> <p>· проводить презентации сервисов Сбера на территории компаний-партнеров</p> <p>· предлагать сервисы Сбера и помогать с их оформлением.</p> <p> </p> <p><strong>Работа в Сбере – это: </strong></p> <p>· стабильный оклад и социальная поддержка сотрудников</p> <p>· официальное оформление с первого дня</p> <p>· расширенный ДМС с первого дня и льготное страхование для близких</p> <p>· мобильная связь, корпоративный ipad</p> <p>· оплата транспортных расходов</p> <p>· теплая база клиентов</p> <p>· корпоративное обучение за счет компании</p> <p>· бесплатная подписка СберПрайм+, скидки на продукты компаний-партнеров: Okko, Сбер Маркет, Delivery Club, Самокат, Сбер Еаптека и других</p> <p>· корпоративная пенсионная программа</p> <p>· ипотека выгоднее на 4% для каждого сотрудника.</p> <p> </p> <p> </p> <p>Присоединяйся к команде клиентских менеджеров Сбера!</p>",Сбербанк
0,55847497,Старший менеджер по обслуживанию (д.Пикшики),"<p>Сбер — лучший работодатель России. У нас более 60 компаний экосистемы и 14 тысяч подразделений по всей стране.</p> <p>Мы ищем старших менеджеров по обслуживанию клиентов Сбера. Это специалисты, которые проводят операции клиентов отделения банка.</p> <p><strong>Эта работа подойдет тебе если ты:</strong></p> <ul> <li>хочешь стать экспертом в банковской сфере</li> <li>доброжелателен и готов помогать клиентам</li> <li>специалист со средним профессиональным, неполным высшим или высшим образованием</li> <li>владеешь программами Microsoft Office, Outlook</li> <li>готов к работе, предполагающей ежедневное проведение однотипных операций.</li> </ul> <p><strong>Тебе предстоит:</strong></p> <ul> <li>осуществлять операции по обслуживанию клиентов</li> <li>проводить кассовые операции: прием, выдача, обмен денег</li> <li>предлагать продукты и сервисы Сбера</li> <li>консультировать клиентов по возникающим вопросам.</li> </ul> <p><strong>Работа в Сбере – это: </strong></p> <ul> <li>стабильный оклад и социальная поддержка сотрудников</li> <li>официальное оформление с первого дня</li> <li>ДМС с первого дня и льготное страхование для близких</li> <li>корпоративное обучение за счет компании</li> <li>бесплатная подписка СберПрайм+, скидки на продукты компаний-партнеров: Okko, Сбер Маркет, Delivery Club, Самокат, Сбер Еаптека и других</li> <li>корпоративная пенсионная программа</li> <li>ипотека выгоднее на 4% для каждого сотрудника.</li> </ul> <p>Присоединяйся к команде старших менеджеров по обслуживанию Сбера!</p>",Сбербанк
0,55878153,Старший менеджер по обслуживанию,"<p>Сбер — лучший работодатель России. У нас более 60 компаний экосистемы и 14 тысяч подразделений по всей стране.</p> <p>Мы ищем старших менеджеров по обслуживанию клиентов Сбера. Это специалисты, которые проводят операции клиентов отделения банка.</p> <p><strong>Эта работа подойдет тебе если ты:</strong></p> <ul> <li>хочешь стать экспертом в банковской сфере</li> <li>доброжелателен и готов помогать клиентам</li> <li>специалист со средним профессиональным, неполным высшим или высшим образованием</li> <li>владеешь программами Microsoft Office, Outlook</li> <li>готов к работе, предполагающей ежедневное проведение однотипных операций.</li> </ul> <p> </p> <p><strong>Тебе предстоит:</strong></p> <ul> <li>осуществлять операции по обслуживанию клиентов</li> <li>проводить кассовые операции: прием, выдача, обмен денег</li> <li>предлагать продукты и сервисы Сбера</li> <li>консультировать клиентов по возникающим вопросам.</li> </ul> <p> </p> <p> </p> <p><strong>Работа в Сбере – это: </strong></p> <ul> <li>стабильный оклад и социальная поддержка сотрудников</li> <li>официальное оформление с первого дня</li> <li>ДМС с первого дня и льготное страхование для близких</li> <li>корпоративное обучение за счет компании</li> <li>бесплатная подписка СберПрайм+, скидки на продукты компаний-партнеров: Okko, Сбер Маркет, Delivery Club, Самокат, Сбер Еаптека и других</li> <li>корпоративная пенсионная программа</li> <li>ипотека выгоднее на 4% для каждого сотрудника.</li> </ul> <p> </p> <p> </p> <p>Присоединяйся к команде старших менеджеров по обслуживанию Сбера!</p> <p> </p> <p> </p>",Сбербанк
0,66082662,Старший менеджер по обслуживанию,"<p>Сбер — лучший работодатель России. У нас более 60 компаний экосистемы и 14 тысяч подразделений по всей стране.</p> <p>Мы ищем старших менеджеров по обслуживанию клиентов Сбера. Это специалисты, которые проводят операции клиентов отделения банка.</p> <p><strong>Эта работа подойдет тебе если ты:</strong></p> <ul> <li>хочешь стать экспертом в банковской сфере</li> <li>доброжелателен и готов помогать клиентам</li> <li>специалист со средним профессиональным, неполным высшим или высшим образованием</li> <li>владеешь программами Microsoft Office, Outlook</li> <li>готов к работе, предполагающей ежедневное проведение однотипных операций.</li> </ul> <p> </p> <p><strong>Тебе предстоит:</strong></p> <ul> <li>осуществлять операции по обслуживанию клиентов</li> <li>проводить кассовые операции: прием, выдача, обмен денег</li> <li>предлагать продукты и сервисы Сбера</li> <li>консультировать клиентов по возникающим вопросам.</li> </ul> <p> </p> <p> </p> <p><strong>Работа в Сбере – это: </strong></p> <ul> <li>стабильный оклад и социальная поддержка сотрудников</li> <li>официальное оформление с первого дня</li> <li>ДМС с первого дня и льготное страхование для близких</li> <li>корпоративное обучение за счет компании</li> <li>бесплатная подписка СберПрайм+, скидки на продукты компаний-партнеров: Okko, Сбер Маркет, Delivery Club, Самокат, Сбер Еаптека и других</li> <li>корпоративная пенсионная программа</li> <li>ипотека выгоднее на 4% для каждого сотрудника.</li> </ul> <p> </p> <p> </p> <p>Присоединяйся к команде старших менеджеров по обслуживанию Сбера!</p> <p> </p>",Сбербанк
