,id,name,description,employer.name
0,52226706,Старший менеджер по обслуживанию,"<p>Сбер — лучший работодатель России. У нас более 60 компаний экосистемы и 14 тысяч подразделений по всей стране.</p> <p>Мы ищем старших менеджеров по обслуживанию клиентов Сбера. Это специалисты, которые проводят операции клиентов в отделении Банка.</p> <p> </p> <p> </p> <p><strong>Эта работа подойдёт тебе если ты:</strong></p> <p>· хочешь стать экспертом в банковской сфере</p> <p>. доброжелателен и готов помогать клиентам</p> <p>. специалист со средним профессиональным, неполным высшим или высшим образованием</p> <p>· владеешь программами Microsoft Office, Internet Explorer, Outlook</p> <p>· готов к работе, предполагающей ежедневное проведение однотипных операций.</p> <p> </p> <p><strong>Тебе предстоит:</strong></p> <p>. Осуществлять операции по обслуживанию клиентов</p> <p>. проводить кассовые операции: прием, выдача, обмен денег</p> <p>. предлагать продукты и сервисы Сбера</p> <p>. консультировать клиентов по возникающим вопросам</p> <p> </p> <p><strong>Работа в Сбере - это:</strong></p> <p>. стабильный оклад и социальная поддержка сотрудников</p> <p>. официальное оформление с первого дня</p> <p>· ДМС с первого дня и льготное страхование для близких</p> <p>. корпоративное обучение за счёт компании</p> <p>· бесплатная подписка СберПрайм+, скидки на продукты компаний-партнеров: Okko, Сбер Маркет, Delivery Club, Сбер Еаптека и других</p> <p>. корпоративная пенсионная программа</p> <p>. ипотека выгоднее на 4% для каждого сотрудника</p> <p><br />Присоединяйся к команде старших менеджеров по обслуживанию Сбера!</p> <ul> </ul>",Сбербанк
0,53686315,Старший менеджер по обслуживанию (п.Тура),"<p>Сбер — лучший работодатель России. У нас более 60 компаний экосистемы и 14 тысяч подразделений по всей стране.</p> <p>Мы ищем старших менеджеров по обслуживанию клиентов Сбера. Это специалисты, которые проводят операции клиентов отделения банка.</p> <p><strong>Эта работа подойдет тебе если ты:</strong></p> <ul> <li>хочешь стать экспертом в банковской сфере</li> <li>доброжелателен и готов помогать клиентам</li> <li>специалист со средним профессиональным, неполным высшим или высшим образованием</li> <li>владеешь программами Microsoft Office, Outlook</li> <li>готов к работе, предполагающей ежедневное проведение однотипных операций.</li> </ul> <p> </p> <p><strong>Тебе предстоит:</strong></p> <ul> <li>осуществлять операции по обслуживанию клиентов</li> <li>проводить кассовые операции: прием, выдача, обмен денег</li> <li>предлагать продукты и сервисы Сбера</li> <li>консультировать клиентов по возникающим вопросам.</li> </ul> <p> </p> <p> </p> <p><strong>Работа в Сбере – это: </strong></p> <ul> <li>стабильный оклад и социальная поддержка сотрудников</li> <li>официальное оформление с первого дня</li> <li>ДМС с первого дня и льготное страхование для близких</li> <li>корпоративное обучение за счет компании</li> <li>бесплатная подписка СберПрайм+, скидки на продукты компаний-партнеров: Okko, Сбер Маркет, Delivery Club, Самокат, Сбер Еаптека и других</li> <li>корпоративная пенсионная программа</li> <li>ипотека выгоднее на 4% для каждого сотрудника.</li> </ul> <p> </p> <p> </p> <p>Присоединяйся к команде старших менеджеров по обслуживанию Сбера!</p> <p> </p> <p> </p>",Сбербанк
0,54462167,Старший менеджер по обслуживанию,"<p>Сбер — лучший работодатель России. У нас более 60 компаний экосистемы и 14 тысяч подразделений по всей стране.</p> <p>Мы ищем старших менеджеров по обслуживанию клиентов Сбера. Это специалисты, которые проводят операции клиентов отделения банка.</p> <p><strong>Эта работа подойдет тебе если ты:</strong></p> <ul> <li>хочешь стать экспертом в банковской сфере</li> <li>доброжелателен и готов помогать клиентам</li> <li>специалист со средним профессиональным, неполным высшим или высшим образованием</li> <li>владеешь программами Microsoft Office, Outlook</li> <li>готов к работе, предполагающей ежедневное проведение однотипных операций.</li> </ul> <p> </p> <p><strong>Тебе предстоит:</strong></p> <ul> <li>осуществлять операции по обслуживанию клиентов</li> <li>проводить кассовые операции: прием, выдача, обмен денег</li> <li>предлагать продукты и сервисы Сбера</li> <li>консультировать клиентов по возникающим вопросам.</li> </ul> <p> </p> <p> </p> <p><strong>Работа в Сбере – это: </strong></p> <ul> <li>стабильный оклад и социальная поддержка сотрудников</li> <li>официальное оформление с первого дня</li> <li>ДМС с первого дня и льготное страхование для близких</li> <li>корпоративное обучение за счет компании</li> <li>бесплатная подписка СберПрайм+, скидки на продукты компаний-партнеров: Okko, Сбер Маркет, Delivery Club, Самокат, Сбер Еаптека и других</li> <li>корпоративная пенсионная программа</li> <li>ипотека выгоднее на 4% для каждого сотрудника.</li> </ul> <p> </p> <p> </p> <p>Присоединяйся к команде старших менеджеров по обслуживанию Сбера!</p>",Сбербанк
0,54567840,Старший менеджер по обслуживанию (с. Бычок),"<p>Сбер — лучший работодатель России. У нас более 60 компаний экосистемы и 14 тысяч подразделений по всей стране.</p> <p>Мы ищем старших менеджеров по обслуживанию клиентов Сбера. Это специалисты, которые проводят операции клиентов отделения банка.</p> <p><strong>Эта работа подойдет тебе если ты:</strong></p> <ul> <li>хочешь стать экспертом в банковской сфере</li> <li>доброжелателен и готов помогать клиентам</li> <li>специалист со средним профессиональным, неполным высшим или высшим образованием</li> <li>владеешь программами Microsoft Office, Outlook</li> <li>готов к работе, предполагающей ежедневное проведение однотипных операций.</li> </ul> <p> </p> <p><strong>Тебе предстоит:</strong></p> <ul> <li>осуществлять операции по обслуживанию клиентов</li> <li>проводить кассовые операции: прием, выдача, обмен денег</li> <li>предлагать продукты и сервисы Сбера</li> <li>консультировать клиентов по возникающим вопросам.</li> </ul> <p> </p> <p> </p> <p><strong>Работа в Сбере – это: </strong></p> <ul> <li>стабильный оклад и социальная поддержка сотрудников</li> <li>официальное оформление с первого дня</li> <li>ДМС с первого дня и льготное страхование для близких</li> <li>корпоративное обучение за счет компании</li> <li>бесплатная подписка СберПрайм+, скидки на продукты компаний-партнеров: Okko, Сбер Маркет, Delivery Club, Самокат, Сбер Еаптека и других</li> <li>корпоративная пенсионная программа</li> <li>ипотека выгоднее на 4% для каждого сотрудника.</li> </ul> <p> </p> <p> </p> <p>Присоединяйся к команде старших менеджеров по обслуживанию Сбера!</p>",Сбербанк
0,55575234,Клиентский менеджер,"<p>Сбер — лучший работодатель России. У нас более 60 компаний экосистемы и 14 тысяч подразделений по всей стране.</p> <p>Мы ищем менеджера по продвижению продуктов Сбера. Это специалист, который помогает с оформлением продуктов и услуг Сбера через планшет и терминалы самообслуживания. Если тебе интересно развиваться в сфере продаж, присоединяйся к команде клиентских менеджеров Сбера.</p> <p><strong>Тебе предстоит:</strong></p> <ul> <li>консультировать клиентов по продуктам Сбера и экосистемы</li> <li>предлагать продукты Сбера</li> <li>помогать с их оформлением.</li> </ul> <p><strong>Работа в Сбере – это: </strong></p> <ul> <li>стабильный оклад и социальная поддержка сотрудников</li> <li>официальное оформление с первого дня</li> <li>ДМС с первого дня и льготное страхование для близких</li> <li>регулярное обучение за счет компании и возможность карьерного роста</li> <li>бесплатная подписка СберПрайм+, скидки на продукты компаний-партнеров: Okko, Сбер Маркет, Delivery Club, Самокат, Сбер Еаптека и других</li> <li>корпоративная пенсионная программа</li> <li>ипотека выгоднее на 4% для каждого сотрудника.</li> </ul> <p> </p> <p>Присоединяйся к команде клиентских менеджеров Сбера!</p>",Сбербанк
0,54567367,Java-разработчик,"<p>Наша команда разрабатывает внутренний портал банка для автоматизации управления сетевым оборудованием (более 8000 устройств) и подключением к ЦОД</p> <p>У нас вы сможете получить большой опыт работы с корпоративным приложением, поработать в кроссплатформенной команде как с Android-, так и с с JavaScript - приложениями. А еще, демо со стекхолдерами с релизом на следующий день. Стекхолдеры на демо дают обратную связь.</p> <p>Мы работаем по двухнедельным спринтам и разработчики сами определяют какой объём задач они смогу выполнить.</p> <p> </p> <p><strong>Обязанности:</strong></p> <ul> <li>Разбор задачи, описанной в терминах бизнеса;</li> <li>Чтение и внесение доработок в чужом коде;</li> <li>Проведение code-review;</li> <li>Поиск и исправление дефектов.</li> </ul> <p> </p> <p><strong>Требования:</strong></p> <p>Java:</p> <ul> <li>Знание фреймворка SpringBoot;</li> <li>Работа с фремворком тестирования JUnit;</li> <li>Создание REST API;</li> <li>Опыт работы с внешними API;</li> <li>Умение работать с потоками и транзакциями.</li> </ul> <p>Postgesql:</p> <ul> <li>Знание SQL;</li> <li>Знание устройств индексов и транзакций;</li> <li>Умение оптимизировать запросы.</li> </ul> <p> </p> <p><strong>Документирование:</strong></p> <ul> <li>Работа с системами контроля версий Гит;</li> <li>Работа по gitflow;</li> <li>Написание самодокументриуемого кода.</li> </ul> <p> </p> <p><strong>Командная работа:</strong></p> <ul> <li>Умение организовать работу по задаче среди нескольких человек;</li> <li>Работа на общий результат;</li> <li>Взаимопомощь;</li> <li>Открытость в отношении с коллегами;</li> <li>Фокус на горизонтальное взаимодействие.</li> </ul> <p> </p> <p><strong>По условиям предлагаем:</strong></p> <ul> <li>Локация: Москва, БЦ «Южный порт» в 10 мин от м. Кожуховская;</li> <li>График: 5/2, а для баланса жизни и работы на выбор: офис или гибрид;</li> <li>Доход: фиксированный оклад + приятная годовая премия.</li> </ul> <p> </p> <p><strong>В Сбере вы можете:</strong></p> <p>✔︎ в свободное время заниматься отдыхом или образованием- комфортные современные офисы, бесплатные перекусы и тренажёрный зал с бассейном, более 7000 курсов на Coursera, внутренняя образовательная платформа с огромной онлайн-библиотека, 20+ профсообществ и др;</p> <p>✔︎ работать там, где у вас есть возможность &quot;выдыхать&quot; и быть собой;</p> <p>✔︎ заботиться о своем ментальном здоровье: ДМС с первого дня, доступ к телемедицине 24/7, помощь психолога;</p> <p>✔︎ меняться и расти, сверяясь с собственными желаниями и потребностями;</p> <p>✔︎ расти профессионально и получать продвижение благодаря достижениям - становиться начальником, если готовы нести ответственность.</p> <p> </p> <p><strong>А еще, Сбер - это технологичная компания, которая:</strong></p> <ul> <li>предоставляет саббатикал - карьерный тайм-аут;</li> <li>премирует в конце года (х2+ от оклада), выплачивается одной выплатой каждый декабрь;</li> <li>дарит бонусы от экосистемы (льготная ипотека и кредиты, скидки, подписки на все сервисы и др.);</li> <li>занимает первое место в рейтинге работодателей России (HeadHunter) и признан лучшим розничным цифровым банком на планете (Global Finance).</li> </ul> <p>Если вам интересна эта вакансия или вы хотите порекомендовать кого-то и получить бонус - напишите, с радостью ответим :)</p>",Сбербанк
0,66119773,Клиентский менеджер,"<p>Сбер — лучший работодатель России. У нас более 60 компаний экосистемы и 14 тысяч подразделений по всей стране.</p> <p>Мы ищем менеджера по продвижению продуктов Сбера. Это специалист, который помогает с оформлением продуктов и услуг Сбера через планшет и терминалы самообслуживания. Если тебе интересно развиваться в сфере продаж, присоединяйся к команде клиентских менеджеров Сбера.</p> <p><strong>Тебе предстоит:</strong></p> <ul> <li>консультировать клиентов по продуктам Сбера и экосистемы</li> <li>предлагать продукты Сбера</li> <li>помогать с их оформлением.</li> </ul> <p><strong>Работа в Сбере – это: </strong></p> <ul> <li>стабильный оклад и социальная поддержка сотрудников</li> <li>официальное оформление с первого дня</li> <li>ДМС с первого дня и льготное страхование для близких</li> <li>регулярное обучение за счет компании и возможность карьерного роста</li> <li>бесплатная подписка СберПрайм+, скидки на продукты компаний-партнеров: Okko, Сбер Маркет, Delivery Club, Самокат, Сбер Еаптека и других</li> <li>корпоративная пенсионная программа</li> <li>ипотека выгоднее на 4% для каждого сотрудника.</li> </ul> <p> </p> <p> </p> <p>Присоединяйся к команде клиентских менеджеров Сбера!</p>",Сбербанк
0,55150424,Аналитик данных (Data Analyst),"<p><strong>Обязанности</strong></p> <p>-Ad hoc аналитика по запросам;</p> <p>-Проверка гипотез, поиск зависимостей;</p> <p>-Анализ существующих решений на предмет оптимальности работы и производительности;</p> <p>-Анализ новых инструментов и технологий в индустрии обработки и анализа данных.</p> <p><strong>Требования</strong></p> <p>-Уверенные знания SQL;</p> <p>-Знание теории вероятностей и математической статистики на базовом уровне;</p> <p>-Участие в проектах построения витрин данных или анализа данных от 1 года с использованием указанных выше технологий;</p> <p>-Желание изучать новые технологии и прагматично их применять.</p> <p><strong>Приветствуется:</strong></p> <p><strong>-Опыт работы с Git, Github, Bitbucket;</strong></p> <p><strong>-Опыт исследования данных средствами Python и использование основных библиотек для анализа данных.</strong></p> <p><strong>Условия</strong></p> <p>-Трудоустройство согласно ТК РФ, полный социальный пакет;</p> <p>-Гарантированный доход плюс премиальное вознаграждение;</p> <p>-Регулярное корпоративное обучение;</p> <p>-Добровольное медицинское страхование;</p> <p>-Бесплатный тренажерный зал с современным оборудованием и групповыми занятиями в здании офиса.</p> <p>-Регулярное корпоративное обучение;</p> <p>-Добровольное медицинское страхование;</p> <p>-Бесплатный тренажерный зал с современным оборудованием и групповыми занятиями в здании офиса.</p>",Сбербанк
0,55130275,Старший клиентский менеджер,"<p>Сбер — лучший работодатель России. У нас более 60 компаний экосистемы и 14 тысяч подразделений по всей стране.</p> <p>Мы ищем старшего менеджера по сопровождению клиентов. Его главная задача – помогать клиентам с оформлением продуктов и услуг Сбера и экосистемы, а также консультировать по возникающим вопросам. Эта вакансия для тех, кто хочет развивать навыки эффективных продаж и стоить карьеру в банковской сфере.</p> <p><strong>Эта работа подойдет тебе если ты:</strong></p> <ul> <li>специалист со средним профессиональным, неполным высшим или высшим образованием</li> <li>имеешь опыт работы в сфере продаж, обслуживания и консультирования клиентов от 6 месяцев</li> <li>доброжелателен и готов помогать клиентам.</li> </ul> <p> </p> <p><strong>Тебе предстоит:</strong></p> <p> </p> <ul> <li>предлагать продукты и услуги Сбера</li> <li>консультировать клиентов по возникающим вопросам</li> <li>помогать клиентам оформлять услуги и необходимые для них документы</li> <li>совершать транзакционные операции в рамках оформления продаж и постпродажного сопровождения клиентов</li> <li>вести базы клиентов.</li> </ul> <p> </p> <p><strong>Работа в Сбере – это: </strong></p> <ul> <li>стабильный оклад и социальная поддержка сотрудников</li> <li>официальное оформление с первого дня</li> <li>расширенный ДМС с первого дня и льготное страхование для близких</li> <li>корпоративное обучение за счет компании</li> <li>бесплатная подписка СберПрайм+, скидки на продукты компаний-партнеров: Okko, Сбер Маркет, Delivery Club, Самокат, Сбер Еаптека и других</li> <li>корпоративная пенсионная программа</li> <li>ипотека выгоднее на 4% для каждого сотрудника.</li> </ul> <p> </p> <p>Присоединяйся к команде старших клиентских менеджеров Сбера!</p>",Сбербанк
