,id,name,description,employer.name
0,55376548,Java разработчик (СберБизнес),"<p>Крупнейший цифровой корпоративный банкинг в России и Восточной Европе ищет в свою команду Middle <strong>Java-разработчика</strong> для платформы СберБизнес.</p> <p>В рамках общей стратегии Сбера монолитная архитектура системы должна быть поэтапно преобразована в микросервисную. Преобразование приведет к созданию многих десятков микросервисов, независимо реализующих пользовательский интерфейс, бизнес-логику и хранение данных. Помимо создания микросервисов, реализующих конкретную бизнес-функциональность, создаются микросервисы общесистемного характера, обеспечивающие ядровые базовые функциональные возможности. Реализация микросервисов и их интеграция базируются на самых современных технологиях и платформах Spring Boot, Docker, OpenShift).</p> <p><strong>Вам предстоит:</strong></p> <ul> <li>проектировать решения, в том числе разрабатывать детальную внутреннюю архитектуру сервиса, включая интеграционные сценарии;</li> <li>принимать участие в разработке крупнейшего в России интернет-банка для юридических лиц;</li> <li>работать в Agile-команде (ежедневные стендапы, 2х-недельные спринты, демонстрация, ретроспектива);</li> <li>проводить и проходить Code Review.</li> </ul> <p><strong>Технологии / фреймворки:</strong></p> <ul> <li>Java 15;</li> <li>Spring Framework, Spring Boot;</li> <li>PostgreSQL / Oracle;</li> <li>Hibernate;</li> <li>Gradle.</li> </ul> <p><strong>Инструменты:</strong></p> <ul> <li>Jenkins, Jira, Bitbucket, Confluence, Docker, OpenShift;</li> </ul> <p><strong>Мы ожидаем, что у вас есть:</strong></p> <ul> <li>опыт от 3х лет разработки высоконагруженных и отказоустойчивых систем;</li> <li>уверенное знание Java 8+;</li> <li>уверенные знания Spring Framework, Spring Boot;</li> <li>умение писать Unit-тесты, знание фреймверков JUnit, Mockito;</li> <li>опыт разработки REST-сервисов;</li> <li>опыт работы с реляционными БД PosgreSQL или Oracle;</li> <li>опыт работы с Docker.</li> </ul> <p><strong>Желательно:</strong></p> <ul> <li>базовые навыки работы в Unix-системах;</li> <li>понимание принципов DevOps и CI/CD;</li> <li>опыт работы с Jenkins;</li> <li>опыт работы с Kafka;</li> <li>опыт работы с Elasticsearch.</li> </ul> <p><strong>Условия:</strong></p> <ul> <li>отличный офис AgileHome рядом со станцией метро Кутузовская:</li> <li>столовые и множество кафе;</li> <li>кухни с холодильниками, кофемашинами и пр.;</li> <li>бесплатный спортзал;</li> <li>и ещё массажные кресла, игровые зоны, библиотека и много чего интересного.</li> <li>полный рабочий день, но гибкий график работы;</li> <li>смешанный режим работы (удаленка + офис);</li> <li>достойная заработная плата (оклад + годовая премия);</li> <li>оформление по ТК РФ;</li> <li>социальный пакет (ДМС);</li> <li>возможность посещения конференций, обучения и сертификации за счёт компании;</li> <li>программа льготного кредитования в Сбербанке;</li> <li>дисконт-программы от множества компаний-партнёров;</li> <li>возможность принять участие в других крупных и уникальных проектах банка;</li> <li>работа в крутой команде над лучшим продуктом – обладателем престижных мировых и российских отраслевых премий и наград.</li> </ul> <p>СберБизнес – лучший цифровой банк для бизнеса по версиям премий Global Finance и MarksWebb. Он насчитывает свыше 2,2 млн активных пользователей в месяц и предлагает клиентам больше, чем консервативный транзакционный банкинг. Для предпринимателей СберБизнес – это платформа для ведения и развития бизнеса, целый мир сервисов и услуг на любом жизненном цикле компании. Каждый день сотни тысяч предприятий по всей стране начинают свой день с операций в СберБизнес.</p> <p>Хочешь войти в команду тех, кто помогает отечественному бизнесу расти и развиваться? Приходи к нам!</p>",Сбербанк
0,55437073,Водитель-инкассатор,"<p>Водители-инкассаторы— это настоящие профессионалы, которые обеспечивают перевозку и сохранность банковских ценностей. В Сбербанке тебя ждет дружный коллектив, современные бронированные автомобили и технологии работы, забота о здоровье и безопасности, а также постоянное профессиональное развитие.</p> <p><strong>Обязанности</strong></p> <p><strong>Тебе предстоит:</strong></p> <ul> <li>перевозить денежные средства, а также другие ценности</li> <li>оказывать инкассаторские услуги клиентам банка</li> <li>обеспечивать сохранность перевозимых ценностей, автотранспорта.</li> </ul> <p><strong>Требования</strong></p> <p><strong>Мы ждем от тебя:</strong></p> <ul> <li>готовность работать на маршруте вдвоем или по одному</li> <li>образование не ниже среднего</li> <li>подтвержденный стаж работы водителем не менее года</li> <li>права категории B</li> <li>хорошую физическую подготовку</li> <li>умение обращаться с оружием или готовность обучаться и сдавать соответствующие нормативы.</li> </ul> <p><strong>Условия</strong></p> <p><strong>Мы предлагаем:</strong></p> <ul> <li>усиленные меры безопасности: современный бронированный автомобиль, бронежилет, спец контейнеры</li> <li>ипотеку выгоднее на 4% для каждого сотрудника</li> <li>гибкий режим работы с суммированным учетом рабочего времени, например, по 12 часов через день, с предоставлением 2-х спаренных выходных дней</li> <li>бесплатную подписку СберПрайм+, скидки на продукты компаний-партнеров: Okko, Сбер Маркет, Delivery Club, Самокат, Сбер Еаптека и другие</li> <li>материальную поддержку в особых жизненных случаях сотрудника и членов его семьи</li> <li>ДМС с первого дня для сотрудников и льготное кредитование для близких</li> <li>корпоративную пенсионную программу</li> <li>обучение за счет Сбера</li> <li>насыщенную корпоративную жизнь с разнообразными мероприятиями для вас и вашей семьи</li> <li>возможность участвовать в конкурсах профессионального мастерства с достойным признанием лучших сотрудников.</li> </ul>",Сбербанк
0,55570977,Java Разработчик,"<p><strong>Сбер</strong> сейчас - это крупнейшая цифровая экосистема. Технобренд, объединяющий лучшие мировые практики и современный стек. Сбер работает над созданием экосистемы удобных онлайн сервисов в самых разных сферах. Сейчас в нее входит более 50 компаний. Среди них- онлайн-кинотеатр Okko, сервис доставки еды Delivery Club и многие другие.</p> <p><strong>О проекте:</strong></p> <p>Мы создаем новую технологическую платформу для экосистемы компании. Наша команда занимается созданием системы для автоматизации бухгалтерского, налогового учета и учета по международным стандартам для группы компаний Сбербанк. Система по масштабам не имеет аналогов в России, перед ней стоят серьезные вызовы по задачам сверхвысоких нагрузок и обработке огромного объема распределенных данных.</p> <p>Ищем Java-разработчика на проект &quot;Главная бухгалтерская книга&quot;.</p> <p>ГБК ППРБ планирует заменить и объединить все существующие учетные системы банка и реализовать одновременный параллельный учет в разных стандартах: бухгалтерские российский и международный, налоговый, управленческий и пр.</p> <p>ГБК ППРБ развивается в тесной интеграции со всеми основными модулями ППРБ: модули розничного и корпоративного блока, единый каталог продуктов и тарифов, управление операционными днями и пр.</p> <p>Вам предстоит интересная и увлекательная работа в кругу коллег разработчиков</p> <p>Первая версия нашего продукта выведена декабре 2017 года в опытную промышленную эксплуатацию, но вместе с тем находится еще в самом начале своего развития. Много задач решено, но еще больше нам предстоит решить вместе.</p> <p><strong>Задачи разработчика:</strong></p> <p>• Разработка высоконагруженных компонентов банковских приложений;</p> <p>• Поиск и проектирование оптимальных решений, прототипирование;</p> <p>• Описание предложений по техническому решению в задачах Jira;</p> <p>• Подготовка в кодовой базе инфраструктуры для решения задач (заглушки);</p> <p>• Проектирование и разработка решений по автоматизации тестирования;</p> <p>• Подготовка в кодовой базе инфраструктуры для unit-тестирования;</p> <p>• Подготовка инфраструктуры для автоматизации тестирования.</p> <p>• Помощь другим разработчикам при проектировании архитектурных решений и интеграционных сценариев;</p> <p>• Контроль качества кода (соглашения, ревью, checkstyle, sonar, и т.п.);</p> <p>• Управление тех. долгом;</p> <p>• Построение контуров CI/CD;</p> <ul> <li>• Поддержка Dev(Sec)Ops в соответствии с методиками принятого производственного процесса Банка</li> </ul> <p><strong>Мы ждем от кандидата:</strong></p> <ul> <li>Знание Java SE;</li> <li>Уверенное понимание принципов многопоточного программирования;</li> <li>Опыт разработки Web-приложений,</li> <li>Понимание принципов клиент-серверного взаимодействия;</li> <li>Опыт работы с серверами приложений JBoss, Apache Tomcat, IBM WebSphere;</li> <li>Знание технологий разработки SpringFramework, Hibernate ORM, JMS, JMX, Junit.</li> <li>Знание технологий разработки интерфейсной части - JavaScript, JQuery, React.</li> <li>Понимание принципов OOП, методологий разработки, шаблонов проектирования;</li> <li>Понимание всего цикла производства ПО, от анализа первичных требований до обновления ПО на серверах и сопровождения пользователей;</li> </ul> <p><strong>Будет преимуществом</strong></p> <ul> <li>Опыт разработки высоконагруженных и распределенных систем,</li> <li>Опыт профилирования приложений - поиск утечек памяти, поиск bottleneck приложений;</li> <li>Опыт работы с системами финансового профиля</li> <li>Опыт работы с системами контроля версий: svn, git.</li> <li>Опыт работы с набором практик DevOps (Jenkins, Ansible, Groovy);</li> <li>Опыт работы с инструментами разработки Intellij IDEA, Jira, Confluence;</li> <li>Уверенные знания в SQL синтаксисе, опыт работы с БД Oracle;</li> <li>Знакомство с IMDG-платформами</li> </ul>",Сбербанк
0,66083043,Инженер сопровождения,"<p><strong>Информация о проекте</strong></p> <p>Трайб «Социальные и зарплатные решения» блока «Розничный бизнес», занимающийся обслуживанием клиентов в рамках зарплатных проектов, ищет администратора тестовых стендов</p> <p><strong>Описание команды</strong></p> <p>На текущий момент в команде работает 9 высококвалифицированных, дружелюбных специалиста по администрированию тестовых стендов</p> <p><strong>Обязанности</strong></p> <p>● Администрирование тестовых сред, предоставление сервиса в рамках принятых SLA;</p> <p>● Обеспечение функционирования сопровождаемых тестовых сред АС в плановом режиме;</p> <p>● Анализ результатов мониторинга, проработка предложений по улучшению производительности и надежности систем;</p> <p>● Выполнение регламентных работ на тестовых стендах;</p> <p>● Решение типовых задач по настройке и системному администрированию, диагностированию неисправностей и восстановлению работоспособности автоматизированных систем;</p> <p>● Автоматизация процессов сопровождения тестовых сред.</p> <p><strong>Требования</strong></p> <p><strong>Мы ожидаем, что Вы:</strong></p> <p>● Высшее техническое образование;</p> <p>● Знания архитектуры сложных клиент-серверных автоматизированных систем, трехзвенной архитектуры;</p> <p>● Опыт решения сложных интеграционных задач;</p> <p>● RHEL/CentOs/Debian – на уровне уверенного администратора;</p> <p>● Знание систем мониторинга (Zabbix, Grafana) на базовом уровне;</p> <p>● Знание языков Python/bash/PowerShell на базовом уровне;</p> <p>● Знания основ сетевых технологий, серверных операционных систем Windows-, *nix- линеек на уровне уверенного пользователя.</p> <p><strong>Будет здорово, если Вы:</strong></p> <p>● СУБД Oracle, PostgreSQL - знание основ, архитектуры, написание запросов;</p> <p>● NGINX, KAFKA – на базовом уровне;</p> <p>● Базовые знания принципов, методов и инструментов DevOps (Jenkins, Ansible, GIT).</p> <p><strong>Условия</strong></p> <p><strong>Работа у нас — это:</strong></p> <p>● Команда профессионалов, готовых поддержать ваши инициативы;</p> <p>● Мощное железо, дополнительные мониторы и всё, что нужно для продуктивной работы;</p> <p>● Возможность работы с новыми технологиями;</p> <p>● Обучение за счёт компании;</p> <p>● Гибкий график;</p> <p>● Красивый и комфортный офис г. Санкт-Петербург, площадь Карла Фаберже, 8Б;</p> <p>● ДМС;</p> <p>● Прозрачная система бонусов и премий, достойная зарплата — размер обсудим на собеседовании.</p>",Сбербанк
0,50819035,"Старший менеджер по обслуживанию (Советский район, д Ефросимовка)","<p>Сбер — лучший работодатель России. У нас более 60 компаний экосистемы и 14 тысяч подразделений по всей стране.</p> <p>Мы ищем старших менеджеров по обслуживанию клиентов Сбера. Это специалисты, которые проводят операции клиентов отделения банка.</p> <p><strong>Эта работа подойдет тебе если ты:</strong></p> <ul> <li>хочешь стать экспертом в банковской сфере</li> <li>доброжелателен и готов помогать клиентам</li> <li>специалист со средним профессиональным, неполным высшим или высшим образованием</li> <li>владеешь программами Microsoft Office, Outlook</li> <li>готов к работе, предполагающей ежедневное проведение однотипных операций.</li> </ul> <p> </p> <p><strong>Тебе предстоит:</strong></p> <ul> <li>осуществлять операции по обслуживанию клиентов</li> <li>проводить кассовые операции: прием, выдача, обмен денег</li> <li>предлагать продукты и сервисы Сбера</li> <li>консультировать клиентов по возникающим вопросам.</li> </ul> <p> </p> <p> </p> <p><strong>Работа в Сбере – это: </strong></p> <ul> <li>стабильный оклад и социальная поддержка сотрудников</li> <li>официальное оформление с первого дня</li> <li>ДМС с первого дня и льготное страхование для близких</li> <li>корпоративное обучение за счет компании</li> <li>бесплатная подписка СберПрайм+, скидки на продукты компаний-партнеров: Okko, Сбер Маркет, Delivery Club, Самокат, Сбер Еаптека и других</li> <li>корпоративная пенсионная программа</li> <li>ипотека выгоднее на 4% для каждого сотрудника.</li> </ul> <p> </p> <p> </p> <p>Присоединяйся к команде старших менеджеров по обслуживанию Сбера!</p>",Сбербанк
0,52003966,"Старший менеджер по обслуживанию (Касторенский район, пгт Новокасторное)","<p>Сбер — лучший работодатель России. У нас более 60 компаний экосистемы и 14 тысяч подразделений по всей стране.</p> <p>Мы ищем старших менеджеров по обслуживанию клиентов Сбера. Это специалисты, которые проводят операции клиентов отделения банка.</p> <p><strong>Эта работа подойдет тебе если ты:</strong></p> <ul> <li>хочешь стать экспертом в банковской сфере</li> <li>доброжелателен и готов помогать клиентам</li> <li>специалист со средним профессиональным, неполным высшим или высшим образованием</li> <li>владеешь программами Microsoft Office, Outlook</li> <li>готов к работе, предполагающей ежедневное проведение однотипных операций.</li> </ul> <p> </p> <p><strong>Тебе предстоит:</strong></p> <ul> <li>осуществлять операции по обслуживанию клиентов</li> <li>проводить кассовые операции: прием, выдача, обмен денег</li> <li>предлагать продукты и сервисы Сбера</li> <li>консультировать клиентов по возникающим вопросам.</li> </ul> <p> </p> <p> </p> <p><strong>Работа в Сбере – это: </strong></p> <ul> <li>стабильный оклад и социальная поддержка сотрудников</li> <li>официальное оформление с первого дня</li> <li>ДМС с первого дня и льготное страхование для близких</li> <li>корпоративное обучение за счет компании</li> <li>бесплатная подписка СберПрайм+, скидки на продукты компаний-партнеров: Okko, Сбер Маркет, Delivery Club, Самокат, Сбер Еаптека и других</li> <li>корпоративная пенсионная программа</li> <li>ипотека выгоднее на 4% для каждого сотрудника.</li> </ul> <p> </p> <p> </p> <p>Присоединяйся к команде старших менеджеров по обслуживанию Сбера!</p>",Сбербанк
