,id,name,description,employer.name
0,55578192,Менеджер по продажам продуктов канала,"<p><strong>Обязанности</strong></p> <ul> <li>поиск и привлечение новых партнеров</li> <li>проведение анализа рынка торгового и интернет эквайринга, платежных сервисов B2B и B2C и выявление потенциальных партнеров на территории</li> <li>продажа продуктов эквайринга и платежных сервисов</li> <li>организация взаимодействия с партнерами</li> <li>выполнение целевых показателей бизнес-плана по направлению продаж продуктов канала</li> <li>участие в организации и проведении совместных акций и мероприятий с партнерами Банка по привлечению клиентов, конференции, федеральные программы</li> <li>проведение анализа рентабельности договоров эквайринга, проведение мероприятий по увеличению рентабельности, переговоры с партнерами по увеличению оборота, виду оборудования, возможности сервисной платы, дополнительных продуктах, изменению тарифа, расторжению договора</li> </ul> <p><strong>Требования</strong></p> <ul> <li>высшее образование</li> <li>опыт работы в активных продажах, финансовом или страховом секторе, сегменте b2b не менее 1 года, опыт привлечения и сопровождения партнеров по эквайрингу является преимуществом</li> <li>знание методики прямых и перекрестных продаж</li> <li>знание методики ведения сложных переговоров и презентаций для массовой аудитории</li> <li>умение работать в режиме многозадачности</li> </ul> <p><strong>Условия</strong></p> <ul> <li>работа в крупнейшем банке России</li> <li>трудоустройство согласно ТК РФ</li> <li>регулярное корпоративное обучение</li> <li>ДМС, страхование от несчастных случаев и тяжелых заболеваний</li> <li>материальная помощь и социальная поддержка, корпоративная пенсионная программа</li> <li>льготные условия кредитования</li> <li>яркая и насыщенная корпоративная жизнь</li> </ul>",Сбербанк
0,55900872,Клиентский менеджер,"<p>Сбер — лучший работодатель России. У нас более 60 компаний экосистемы и 14 тысяч подразделений по всей стране.</p> <p>Мы ищем менеджера по продвижению продуктов Сбера. Это специалист, который помогает с оформлением продуктов и услуг Сбера через планшет и терминалы самообслуживания. Если тебе интересно развиваться в сфере продаж, присоединяйся к команде клиентских менеджеров Сбера.</p> <p><strong>Тебе предстоит:</strong></p> <ul> <li>консультировать клиентов по продуктам Сбера и экосистемы</li> <li>предлагать продукты Сбера</li> <li>помогать с их оформлением.</li> </ul> <p><strong>Работа в Сбере – это: </strong></p> <ul> <li>стабильный оклад и социальная поддержка сотрудников</li> <li>официальное оформление с первого дня</li> <li>ДМС с первого дня и льготное страхование для близких</li> <li>регулярное обучение за счет компании и возможность карьерного роста</li> <li>бесплатная подписка СберПрайм+, скидки на продукты компаний-партнеров: Okko, Сбер Маркет, Delivery Club, Самокат, Сбер Еаптека и других</li> <li>корпоративная пенсионная программа</li> <li>ипотека выгоднее на 4% для каждого сотрудника.</li> </ul> <p> </p> <p> </p> <p>Присоединяйся к команде клиентских менеджеров Сбера!</p> <p> </p>",Сбербанк
0,66101808,Старший менеджер по обслуживанию (с. Подгорное Ленинск-Кузнецкий р-н),"<p>Сбер — лучший работодатель России. У нас более 60 компаний экосистемы и 14 тысяч подразделений по всей стране.</p> <p>Мы ищем старших менеджеров по обслуживанию клиентов Сбера. Это специалисты, которые проводят операции клиентов отделения банка.</p> <p><strong>Эта работа подойдет тебе если ты:</strong></p> <ul> <li>хочешь стать экспертом в банковской сфере</li> <li>доброжелателен и готов помогать клиентам</li> <li>специалист со средним профессиональным, неполным высшим или высшим образованием</li> <li>владеешь программами Microsoft Office, Outlook</li> <li>готов к работе, предполагающей ежедневное проведение однотипных операций.</li> </ul> <p> </p> <p><strong>Тебе предстоит:</strong></p> <ul> <li>осуществлять операции по обслуживанию клиентов</li> <li>проводить кассовые операции: прием, выдача, обмен денег</li> <li>предлагать продукты и сервисы Сбера</li> <li>консультировать клиентов по возникающим вопросам</li> <li><strong>режим работы: 0,25 ставки; вторник, пятница с 8.00 до 13.00, возможность работать по совместительству</strong>.</li> </ul> <p> </p> <p><strong>Работа в Сбере – это: </strong></p> <ul> <li>стабильный оклад и социальная поддержка сотрудников</li> <li>официальное оформление с первого дня</li> <li>ДМС с первого дня и льготное страхование для близких</li> <li>корпоративное обучение за счет компании</li> <li>бесплатная подписка СберПрайм+, скидки на продукты компаний-партнеров: Okko, Сбер Маркет, Delivery Club, Самокат, Сбер Еаптека и других</li> <li>корпоративная пенсионная программа</li> <li>ипотека выгоднее на 4% для каждого сотрудника.</li> </ul> <p> </p> <p> </p> <p>Присоединяйся к команде старших менеджеров по обслуживанию Сбер!</p>",Сбербанк
0,54738028,Главный инженер по сопровождению,"<p>SberData - департамент по управлению данными всего Сбербанка. SberData строит централизованное хранилище данных, объем которого уже превышает 60 ПБ. Это продуктово-ориентированная инженерная команда с функциями развития выделенных технологических направлений, отражающих новый подход Сбербанка к данным и к применению AI.</p> <p>УСКАП – это управление занимающаяся сопровождением и развитием инфраструктуры Hadoop. С помощью нашей команды осуществляется надежность выполнения критичных бизнес-процессов, своевременное устранение и анализ проблем на Hadoop кластерах и принятом на сопровождение ППО разработанном в Сбербанке для Корпоративной Аналитической Платформы.</p> <p> </p> <p><strong>Обязанности:</strong></p> <ul> <li>Администрирование и сопровождение АС и сервисов на базе Hadoop в роли 2-ой линии сопровождения;</li> <li>Решение инцидентов, обработка запросов на обслуживание и изменения;</li> <li>Выполнение работ по настройке и поддержке тестового и промышленного стендов;</li> <li>Организация внедрения и проведение приемо-сдаточных и нагрузочных испытаний ПО, взаимодействие с подразделениями разработки и тестирования ПО;</li> <li>Настройка и поддержка интеграционных решений со смежными системами;</li> <li>Участие в проектах, затрагивающих загрузку, хранение, обработку больших данных в роли ops и devops инженера;</li> <li>Мониторинг, диагностика и оперативное устранение проблем в функционировании сервисов, контроль работоспособности приложений и предупреждение критических ситуаций;</li> <li>Разработка метрик/dashboard для мониторинга АС и прикладных сервисов;</li> <li>Разработка скриптов для автоматизации повседневной деятельности;</li> <li>Ведение технической документации по эксплуатации действующих сервисов.</li> </ul> <p> </p> <p><strong>Требования:</strong></p> <ul> <li>Знание ITSM, ITIL;</li> <li>Опыт работы с Jira, Confluence;</li> <li>Опыт использования и построения отчётов в Grafana, Zabbix, Prometheus или других системы мониторинга;</li> <li>Опыт использования технологий DevOps и версионного контроля (Jenkins, Bitbucket), Ansible;</li> <li>Опыт работы с реляционными БД (Oracle, PostgreSQL) и NoSQL решениями;</li> <li>Опыт работы с Linux на уровне администратора от одного года;</li> <li>Опыт разработки скриптов на Bash/Python;</li> <li>Знание стека ELK и систем логирования;</li> <li>Опыт работы с Hadoop/Ambari (желательно);</li> <li>Технический английский, желание и умение читать техническую документацию.</li> </ul> <p> </p> <p><strong>Условия:</strong></p> <ul> <li>Структура дохода: фиксированный оклад + годовая премия (выплата в конце года);</li> <li>Место работы: г. Москва, м. Верхние Котлы/ Тульская / Нагатинская (Бизнес центр «Даниловский Форт»);</li> <li>Официальное трудоустройство;</li> <li>График работы: 5/2 с 9:00 до 18:00 (есть возможность изменить часы прихода-ухода);</li> <li>Бессрочный трудовой договор;</li> <li>ДМС;</li> <li>Бесплатный фитнес на территории работодателя;</li> <li>Внутренние и внешние курсы повышения квалификации.</li> </ul>",Сбербанк
0,55851734,Старший менеджер по обслуживанию (Горохово),"<p>Сбер — лучший работодатель России. У нас более 60 компаний экосистемы и 14 тысяч подразделений по всей стране.</p> <p>Мы ищем старших менеджеров по обслуживанию клиентов Сбера. Это специалисты, которые проводят операции клиентов отделения банка.</p> <p><strong>Эта работа подойдет тебе если ты:</strong></p> <ul> <li>хочешь стать экспертом в банковской сфере</li> <li>доброжелателен и готов помогать клиентам</li> <li>специалист со средним профессиональным, неполным высшим или высшим образованием</li> <li>владеешь программами Microsoft Office, Outlook</li> <li>готов к работе, предполагающей ежедневное проведение однотипных операций.</li> </ul> <p> </p> <p><strong>Тебе предстоит:</strong></p> <ul> <li>осуществлять операции по обслуживанию клиентов</li> <li>проводить кассовые операции: прием, выдача, обмен денег</li> <li>предлагать продукты и сервисы Сбера</li> <li>консультировать клиентов по возникающим вопросам.</li> </ul> <p> </p> <p> </p> <p><strong>Работа в Сбере – это: </strong></p> <ul> <li>стабильный оклад и социальная поддержка сотрудников</li> <li>официальное оформление с первого дня</li> <li>ДМС с первого дня и льготное страхование для близких</li> <li>корпоративное обучение за счет компании</li> <li>бесплатная подписка СберПрайм+, скидки на продукты компаний-партнеров: Okko, Сбер Маркет, Delivery Club, Самокат, Сбер Еаптека и других</li> <li>корпоративная пенсионная программа</li> <li>ипотека выгоднее на 4% для каждого сотрудника.</li> </ul> <p> </p> <p> </p> <p>Присоединяйся к команде старших менеджеров по обслуживанию Сбера!</p> <p> </p>",Сбербанк
0,66135128,Старший менеджер по обслуживанию,"<p>​​​</p> <p>Сбер — лучший работодатель России. У нас более 60 компаний экосистемы и 14 тысяч подразделений по всей стране.</p> <p>Мы ищем старших менеджеров по обслуживанию клиентов Сбера. Это специалисты, которые проводят операции клиентов отделения банка.</p> <p><strong>Эта работа подойдет тебе если ты:</strong></p> <ul> <li>хочешь стать экспертом в банковской сфере</li> <li>доброжелателен и готов помогать клиентам</li> <li>специалист со средним профессиональным, неполным высшим или высшим образованием</li> <li>владеешь программами Microsoft Office, Outlook</li> <li>готов к работе, предполагающей ежедневное проведение однотипных операций.</li> </ul> <p> </p> <p><strong>Тебе предстоит:</strong></p> <ul> <li>осуществлять операции по обслуживанию клиентов</li> <li>проводить кассовые операции: прием, выдача, обмен денег</li> <li>предлагать продукты и сервисы Сбера</li> <li>консультировать клиентов по возникающим вопросам.</li> </ul> <p> </p> <p> </p> <p><strong>Работа в Сбере – это: </strong></p> <ul> <li>стабильный оклад и социальная поддержка сотрудников</li> <li>официальное оформление с первого дня</li> <li>ДМС с первого дня и льготное страхование для близких</li> <li>корпоративное обучение за счет компании</li> <li>бесплатная подписка СберПрайм+, скидки на продукты компаний-партнеров: Okko, Сбер Маркет, Delivery Club, Самокат, Сбер Еаптека и других</li> <li>корпоративная пенсионная программа</li> <li>ипотека выгоднее на 4% для каждого сотрудника.</li> </ul> <p> </p> <p> </p> <p>Присоединяйся к команде старших менеджеров по обслуживанию Сбера!</p> <p> </p> <p> </p> <p> </p> <p> </p>",Сбербанк
0,55587903,DevOps инженер,"<p>SberData – департамент по управлению данными всего Сбербанка. SberData строит централизованное хранилище данных, объем которого уже превышает 100 ПБ. Это продуктово-ориентированная инженерная команда с функциями развития выделенных технологических направлений, отражающих новый подход Сбербанка к данным и к применению AI.</p> <p>Мы создаем платформу создания и исполнения AI-моделей — это комплексное решение, которое позволяет исполнять модели машинного обучения в рамках различных бизнес-процессов. Исполнение моделей применяется в рамках автоматизированного принятия решений, расчета риск-метрик, прогнозирования, распознавания текста, голоса, изображений.</p> <p><strong>Что мы предлагаем:</strong></p> <ul> <li>Работа в компании-поставщике IT-услуг для крупнейшего Банка России и Восточной Европы;</li> <li>Проекты, превосходящие по масштабу любые другие в отрасли - пользователями наших продуктов являются все клиенты Сбербанка и Экосистемы Sber;</li> <li>Реализацию платформенных решений в рамках программы по AI-трансформации Сбербанка;</li> <li>Работу в команде молодых специалистов из лучших университетов (МИФИ, МГУ, МГТУ им. Баумана, МФТИ и др.).</li> </ul> <p>И сейчас мы в поиске DevOps инженера в нашу команду!</p> <p><strong>Функциональные обязанности:</strong></p> <ul> <li>Построение CI/CD процесса;</li> <li>Анализ и реализация новых требований к системам: архитектурных, методологических, технических;</li> <li>Оптимизация существующих решений, повышение отказоустойчивости систем;</li> <li>Участие в написании технической документации;</li> <li>Участие в проработке решений по развитию продукта;</li> <li>Участие решении инцидентов.</li> </ul> <p><strong>Требования к кандидату:</strong></p> <ul> <li>Опыт сопровождения высоконагруженных систем;</li> <li>Опыт построения мониторингов с помощью инструментов Splunk/ELK/Zabbix/Grafana/Prometheus;</li> <li>Базовые знания Java 8;</li> <li>Опыт и хорошее понимание интеграционных взаимодействий;</li> <li>Опыт работы с реляционными БД (анализ нагрузки, оптимизация);</li> <li>Опыт работы с cloud native решениями;</li> <li>Стремление к самообразованию, а также желание получать бесценный опыт у экспертов отрасли;</li> <li>Навыки самостоятельной и осознанной работы с оформлением задач в отчётных системах (HP Service Manager, Jira, Confluence);</li> <li>Желание работать в составе сплоченной многофункциональной команды Agile;</li> <li>Опыт работы со средствами автоматизации разработки/сборки/доставки программных решений (CI/CD).</li> </ul> <p><strong>Знание:</strong></p> <ul> <li>Основ сетевых технологий и серверной архитектуры;</li> <li>Серверных операционных систем Windows-, *nix- линеек на уровне уверенного пользователя;</li> <li>Основ SQL;</li> <li>Английского языка на уровне чтения со словарём или выше.</li> </ul> <p><strong>Навыки: </strong></p> <ul> <li>Администрирование Linux на базе Redhat;</li> <li>Работа с docker, kubernetes, OpenShift;</li> <li>Работа с БД Oracle, Postgresql;</li> <li>Работа с Jenkins;</li> <li>Работа с системами контроля версий (Git, svn).</li> </ul> <p> </p> <p><strong>Условия:</strong></p> <ul> <li>Гибкий график для оптимального баланса работы и личной жизни;</li> <li>Профессиональное обучение, семинары, тренинги, конференции, корпоративная библиотека;</li> <li>ДМС, страхование жизни;</li> <li>Самые инновационные, амбициозные проекты и задачи;</li> <li>Свободный дресс-код;</li> <li>Льготные кредиты и корпоративные скидки;</li> <li>Конкурентная компенсация (оклад и премии по результатам деятельности).</li> </ul>",Сбербанк
