,id,name,description,employer.name
0,55331815,Delivery manager,"<p><strong>Sberdata </strong>разрабатывает платформу для поставки, хранения и обработки данных SDP Hadoop.</p> <p>Основная задача - создание собственной сборки дистрибутива Hadoop на основе open source решений.</p> <p>Разрабатывается несколько продуктов - от инструментов для разработки, до гибко масштабируемых кластеров во внутреннем облаке.</p> <p>SDP Hadoop доступна как часть платформы Гостех и в публичном облаке Sbercloud</p> <p> </p> <p><strong>Обязанности:</strong></p> <p>1. Организация выпуска релиза:</p> <p>- Формирование релиза в jira;</p> <p>- Контроль сроков по задачам релиза;</p> <p>- Контроль сроков тестирования;</p> <p>- Работы по обновлению стенда;</p> <p>- Сбор участников ПСИ;</p> <p>- Проведение ПСИ;</p> <p>2. Составление и ведение оперативных планов:</p> <p> Jira</p> <p>- Задачи разработки;</p> <p>- Ведение критических замечаний</p> <p>- Требования от бизнес команд</p> <p>Не Jira</p> <p>- Поставки КТС;</p> <p>- Работы смежных команд/управлений;</p> <p>- Формирование внешних зависимостей;</p> <p>3. Обработка входящих задач:</p> <p>4. Организация работ с подрядчиком:</p> <p>- Обеспечение технической возможности работы подрядчика;</p> <p>- Работа со спецификациями;</p> <p>- Синхронизация планов.</p> <p><strong>Требования:</strong></p> <ul> <li>Опыт и понимание механизмов работы систем контроля версий;</li> <li>Опыт и понимание механизмов работы систем управления сборкой;</li> <li>Опыт создания автосборок дистрибутивов;</li> <li>Опыт и понимание механизмов построения модульных тестов;</li> <li>Опыт и понимание механизмов работы систем функционального и автоматизированного тестирования;</li> <li>Владение инструментами автоматического развертывания дистрибутивов и управления конфигурациями сред ;</li> <li>Опыт администрирования Linux (предпочтение RHEL/CentOS);</li> </ul> <p><strong>Условия:</strong></p> <ul> <li>Профессиональное обучение, семинары, тренинги, конференции, корпоративная библиотека;</li> <li>ДМС, страхование жизни;</li> <li>Самые инновационные, амбициозные проекты и задачи;</li> <li>Свободный дресс-код;</li> <li>Гибкий график для оптимального баланса работы и личной жизни;</li> <li>Льготные кредиты и корпоративные скидки;</li> <li>Конкурентная компенсация (оклад и премии по результатам деятельности).</li> </ul>",Сбербанк
0,55899100,Старший специалист судебного и исполнительного производства,"<strong>Обязанности:</strong> <ul> <li>построение полноценной, эффективной системы коммуникаций с должниками, направленной на максимальное погашение проблемной задолженности на этапе судебного и исполнительного производства</li> <li>выезды в Федеральную службу судебных приставов, иные государственные органы, по месту жительства, работы, месту ведения бизнеса должников, поручителей, залогодателей</li> <li>телефонные и очные переговоры с должниками, поручителями, залогодателями, а также с работодателями, родственниками и доверенными лицами должников</li> <li>осуществление действий по государственной регистрации в отношении предметов залога в соответствии с нормами законодательства Российской Федерации</li> <li>поиск контактных данных должников, поручителей, залогодателей в доступных источниках</li> <li>внесение информации в карточки мониторинга проблемной задолженности в автоматизированные системы Банка</li> </ul> <strong>Требования:</strong> <ul> <li>образование: не ниже средне- специального</li> <li>знание стандартных программных продуктов MS Office (Word, Excel, Outlook, Power Point, Visio), АС Консультант Плюс</li> <li>опыт работы по соответствующему направлению в банке или коллекторском агентстве по взысканию на поздних стадиях не менее 1 года</li> </ul> <strong>Условия:</strong> <ul> <li>оформление согласно ТК РФ</li> <li>возможность профессионального и карьерного развития</li> <li>премирование (ежемесячное, годовое)</li> <li>корпоративное обучение</li> <li>компенсация мобильной связи</li> <li>гибкий график: 5-дневная рабочая неделя, 2 выходных в неделю</li> <li>активная корпоративная жизнь банка</li> <li>скидка на ипотечное кредитование</li> </ul>",Сбербанк
0,55891891,Аналитик корпоративной риск-отчетности,"<p><strong>Задачи:</strong></p> <ul> <li>Подготовка аналитических отчетов по корпоративному кредитному портфелю для руководства Блока Риски (риск/доходность, динамика, тренды и т.д.);</li> <li>Взаимодействие с заказчиками в процессе подготовки отчетов: формирования понятного ТЗ, DoD, визуализация информации;</li> <li>Поиск информации в различных базах данных Банка (Teradata, Oracle, Hadoop, SQL Server);</li> <li>Анализ полученной информации в соответствии с ТЗ заказчика и ее визуализация (PowerPoint, QlikView);</li> <li>Взаимодействие с представителями других Блоков и Департаментов по вопросам качества данных, поставки данных и т.п.;</li> <li>Написание технического задания по автоматизации отчетов для команды разработки.</li> </ul> <p><strong>Требования:</strong></p> <ul> <li>Высшее Техническое/Экономическое образование;</li> <li>Опыт работы в финансовых организациях в роли аналитика не менее 1 года;</li> <li>Уверенное владение SQL (умение читать/писать сложные скрипты);</li> <li>Знание основных кредитных риск метрик/кредитных продуктов корпоративного портфеля;</li> <li>Базовые знания кредитного процесса;</li> <li>Аналитический склад ума, умение работать с большим объемом данных.</li> </ul> <p><strong>Мы предлагаем:</strong></p> <ul> <li>Стабильную работу в высокопрофессиональной среде;</li> <li>Карьерный путь в международной организации;</li> <li>Возможность заметно влиять на бизнес банка;</li> <li>ДМС, фитнес-центр;</li> <li>Корпоративное обучение, курсы и тренинги;</li> <li>Современный офис в Москве на Кутузовском</li> </ul>",Сбербанк
0,66106817,Системный аналитик,"<p>Сбер — больше чем банк, это вселенная полезных сервисов для повседневной жизни человека.</p> <p>Сбер сегодня - это гибкие методологии разработки Agile, масштабные высоконагруженные проекты, а также современные технологии. Каждый из нас превращает банк в экосистему, которая окружает человека удобными сервисами и продуктами для жизни</p> <p>Мы ищем <strong>аналитика</strong> в команду развития ППРБ Кредиты для юр.лиц для анализа и постановки задач по разработке функционала Кредитования юридических лиц.</p> <p><strong>Мы ожидаем, что Вы:</strong></p> <ul> <li>С высшим техническим образованием.</li> <li>С опытом работы в роли аналитика от 2-х лет.</li> <li>Имеете навыки написания функциональных требований/бизнес-требований/технических спецификаций на разработку.</li> <li>Имеете опыт работы с Confluence и Jira.</li> <li>Имеете опыт работы по Waterfall и Agile.</li> <li>Умеете работать в команде.</li> <li>Способны вести конструктивный диалог с заказчиками.</li> </ul> <p><strong>Будет здорово, если вы:</strong></p> <ul> <li>Обладаете знаниями принципов ведения бухгалтерского учета в финансовой организации.</li> <li>Умеете работать с базами данных (Oracle, PostgreSQL).</li> <li>Знаете методологии функционального и процессного моделирования в нотациях BPMN, UML.</li> <li>Имеете опыт применения современных подходов к проектированию интеграций на основе rest, MQ.</li> </ul> <p><strong>Вам предстоит:</strong></p> <ul> <li>Анализ бизнес-требований, описание и моделирование бизнес процессов для дальнейшей автоматизации.</li> <li>Выявление и формализация функциональных требований к банковским информационным системам.</li> <li>Управление приоритетами требований.</li> <li>Согласование требований с руководством и с заказчиком.</li> <li>Постановка задачи для разработчиков (проектирование пользовательских интерфейсов, проработка функциональных требований к проектируемой системе).</li> <li>Декомпозиция задач и ведение бэклога команды.</li> <li>Взаимодействие с разработчиками и тестировщиками на этапе реализации требований.</li> <li>Участие в ПСИ с бизнес-пользователями и сотрудниками ИБ.</li> <li>Написание проектной документации, документации по произведенным доработкам (при необходимости).</li> </ul>",Сбербанк
0,54144294,Старший менеджер по обслуживанию,"<p>Сбер — лучший работодатель России. У нас более 60 компаний экосистемы и 14 тысяч подразделений по всей стране.</p> <p> </p> <p>Старшие менеджеры по обслуживанию в Сбере – это специалисты, которые проводят операции клиентов отделения в кассе.</p> <p><strong>Эта работа подойдет тебе если ты:</strong></p> <ul> <li>хочешь стать экспертом в банковской сфере</li> <li>доброжелателен и готов помогать клиентам</li> <li>специалист со средним профессиональным, неполным высшим или высшим образованием</li> <li>владеешь программами Microsoft Office, Outlook</li> <li>готов к работе, предполагающей ежедневное проведение однотипных операций.</li> </ul> <p> </p> <p><strong>Тебе предстоит:</strong></p> <ul> <li>работать с клиентами в отделении</li> <li>проводить кассовые операции: прием, выдача, обмен денег.</li> </ul> <p> </p> <p> </p> <p><strong>Работа в Сбере – это: </strong></p> <ul> <li>официальное оформление с первого дня</li> <li>ДМС с первого дня и льготное страхование для близких</li> <li>стабильный оклад и премии по результатам работы</li> <li>регулярное обучение за счет компании и возможность карьерного роста</li> <li>ипотека выгоднее на 4% для каждого сотрудника</li> <li>льготные условия кредитования</li> <li>бесплатная подписка СберПрайм+, скидки на продукты компаний-партнеров: Okko, Сбер Маркет, Delivery Club, Самокат, Ситимобил, Сбер Еаптека и других</li> <li>реферальная программа для сотрудников: можно пригласить в команду знакомых профессионалов и получить вознаграждение до 100 тыс. рублей</li> <li>корпоративная пенсионная программа.</li> </ul> <p> </p> <p>Присоединяйся к команде старших менеджеров по обслуживанию Сбера!</p> <p> </p>",Сбербанк
0,54737697,Главный инженер сопровождения технологических сервисов платформы ,"<p>SberData - департамент по управлению данными всего Сбербанка. SberData строит централизованное хранилище данных, объем которого уже превышает 60 ПБ. Это продуктово-ориентированная инженерная команда с функциями развития выделенных технологических направлений, отражающих новый подход Сбербанка к данным и к применению AI.</p> <p>УСКАП – это управление занимающаяся сопровождением и развитием инфраструктуры Hadoop. С помощью нашей команды осуществляется надежность выполнения критичных бизнес-процессов, своевременное устранение и анализ проблем на Hadoop кластерах и принятом на сопровождение ППО разработанном в Сбербанке для Корпоративной Аналитической Платформы.</p> <p> </p> <p><strong>Кто мы и кого мы ищем:</strong></p> <p>Мы – команда сопровождения корпоративной аналитической платформы по управлению данными Сбербанка.</p> <p>С помощью нашей команды обеспечивается надежность выполнения всех критичных бизнес-процессов, связанных с хранением, управлением и передачей данных, а также своевременное устранение всех инфраструктурных проблем.</p> <p>Мы ищем к себе в команду толковых инженеров для обеспечения поддержки основного технологического сервиса по управлению потоками данных. Приветствуется твоя способность быстро учиться и готовность узнать платформу и сервис для решения задач развития и сопровождения.</p> <p> </p> <p> </p> <p><strong>Обязанности:</strong></p> <p>На первом шаге нужно будет изучить, как работают сервис по управлению потоками данных и смежный сервис сообщений на платформе SberData и как их можно применять, далее:</p> <ul> <li>Администрирование и сопровождение сервисов в качестве 2-ой линии сопровождения;</li> <li>Решение инцидентов, обработка различных запросов на обслуживание и изменение;</li> <li>Проведение ежедневного мониторинга, диагностики, контроль работоспособности приложений и предупреждение критических ситуаций;</li> <li>Организация и проведение ПСИ для вывода функциональности в ПРОМ;</li> <li>Установка и вывод новых версий ПО (релиз, хот-фикс) на ПСИ и ПРОМ среды;</li> <li>Выполнение инфраструктурных работ по настройке и поддержке промышленного и ПСИ контуров;</li> <li>Работа с киберрисками, устранение уязвимостей ПО;</li> <li>Участие в проектах развития сервиса, взаимодействие с командами разработки, тестирования и смежными командами;</li> <li>Ведение технической документации и базы знаний по эксплуатации и решению инцидентов;</li> <li>Консультация потребителей по работе с сервисом.</li> </ul> <p> </p> <p><strong>Требования:</strong></p> <ul> <li>Высшее техническое образование;</li> <li>Опыт сопровождения / установки / поддержки работы специализированного ПО от 2-3 лет;</li> <li>Навыки администрирования Linux - уровень middle;</li> <li>Понимание принципов работы: процессы, демоны, сервисы, файловые системы, разграничение доступа;</li> <li>Опыт работы с асимметричным шифрованием – сертификаты, кейтабы;</li> <li>Знание основ SQL и администрирования СУБД PostgreSQL - уровень middle;</li> <li>Понимание принципов работы реляционных СУБД;</li> <li>Написание запросов к БД PostgreSQL разного уровня сложности;</li> <li>Знание скриптовых языков на базовом уровне: Bash, Python;</li> <li>Навыки работы с Apache Kafka;</li> <li>Умение читать logs для решений на базе Java, PostgreSQL и Linux;</li> <li>Знание методов поиска и обнаружения неисправностей в ПО, анализ проблем;</li> <li>Хорошие коммуникативные навыки и работы в команде;</li> <li>Знание английского языка на уровне чтения технической документации.</li> </ul> <p> </p> <p><strong>Желательно:</strong></p> <ul> <li>Навыки DevOps по автоматизация – создание плейбуков Ansible, простых pipeline на базе Jenkins;</li> <li>Навыки работы с Nginx;</li> <li>Опыт использования и построения отчётов в Grafana, Zabbix, Prometheus;</li> <li>Опыт работы с Jira, Confluence.</li> </ul> <p> </p> <p><strong>Будет плюсом:</strong></p> <ul> <li>Навыки и опыт работы с BigData. Знание Hadoop, HDFS и Cloudera Manager;</li> <li>Понимание ETL-процессов и опыт работы с ETL -инструментами.</li> </ul> <p> </p> <p><strong>Условия:</strong></p> <ul> <li>Интересные и масштабные проекты и задачи в области BigData;</li> <li>Свободный дресс-код;</li> <li>БЦ &quot;Даниловский ФОрт&quot; - м.Нагатинская/Тульская/Верхние котлы/Коломенская;</li> <li>Бесплатный фитнес-зал в БЦ;</li> <li>Профессиональное обучение, семинары, тренинги, конференции, корпоративная библиотека;</li> <li>Работа в крупнейшем банке Восточной Европы;</li> <li>Трудоустройство согласно ТК РФ;</li> <li>Конкурентная материальная компенсация (оклад + годовой бонус по результатам деятельности);</li> <li>ДМС, страхование от несчастных случаев и тяжелых заболеваний;</li> <li>Льготные и дисконт-программы от Сбера и множества компаний партнеров;</li> <li>Материальная помощь и социальная поддержка, корпоративная пенсионная программа;</li> <li>Яркая и насыщенная корпоративная жизнь.</li> </ul>",Сбербанк
